url,Title link,Title link_link,Mediainner image,Description,Buy link_link,Video link_link,Website link_link
http://iotlist.co/?page=24,RICOH THETA: Capture your complete surroundings,http://iotlist.co/posts/ricoh-theta-capture-your-complete-surroundings,http://iotlist-production.s3-us-west-2.amazonaws.com/uploads/production/post_attachment/488/file/vi.png,You can capture your complete surroundings with the simple press of the shutter button. RICOH THETA will automatically adjust the image orientation so that you don‰Ûªt have to worry about how you‰Ûªre holding the camera. You can simply take pictures at the precise moment you choose.,http://www.pentaxwebstore.com/product/44687,http://iotlist.co/posts/ricoh-theta-capture-your-complete-surroundings,https://theta360.com/en/
http://iotlist.co/?page=25,RICOH THETA: Capture your complete surroundings,http://iotlist.co/posts/ricoh-theta-capture-your-complete-surroundings,http://iotlist-production.s3-us-west-2.amazonaws.com/uploads/production/post_attachment/488/file/vi.png,You can capture your complete surroundings with the simple press of the shutter button. RICOH THETA will automatically adjust the image orientation so that you don‰Ûªt have to worry about how you‰Ûªre holding the camera. You can simply take pictures at the precise moment you choose.,http://www.pentaxwebstore.com/product/44687,http://iotlist.co/posts/ricoh-theta-capture-your-complete-surroundings,https://theta360.com/en/
http://iotlist.co/?page=14,Ring: Smart doorbell with video,http://iotlist.co/posts/ring-smart-doorbell-with-video,http://iotlist-production.s3-us-west-2.amazonaws.com/uploads/production/post_attachment/795/file/Screen_Shot_2014-09-29_at_3.03.42_PM.png,"See who‰Ûªs there, from anywhere. With wide angled HD video, smart motion detection, and cloud recording, it‰Ûªs like you‰Ûªre home even when you‰Ûªre not.",http://amzn.to/1D2Cd2t,http://iotlist.co/posts/ring-smart-doorbell-with-video,https://ring.com/
http://iotlist.co/?page=27,Ring: Wearable input device that lets you control anything,http://iotlist.co/posts/ring-wearable-input-device-that-lets-you-control-anything,http://iotlist-production.s3-us-west-2.amazonaws.com/uploads/production/post_attachment/412/file/b8bcc57e8d1aa7ffc6e3ffa012ec9011_large.png,"Ring is like magic, allowing you to control anything you want, by wearing it on your finger. You can send texts, control home appliances, and even pay your bills ‰ÛÓ all at once and in a flash.",https://www.kickstarter.com/projects/1761670738/ring-shortcut-everything,http://iotlist.co/posts/ring-wearable-input-device-that-lets-you-control-anything,http://logbar.jp/ring/
http://iotlist.co/?page=28,Ring: Wearable input device that lets you control anything,http://iotlist.co/posts/ring-wearable-input-device-that-lets-you-control-anything,http://iotlist-production.s3-us-west-2.amazonaws.com/uploads/production/post_attachment/412/file/b8bcc57e8d1aa7ffc6e3ffa012ec9011_large.png,"Ring is like magic, allowing you to control anything you want, by wearing it on your finger. You can send texts, control home appliances, and even pay your bills ‰ÛÓ all at once and in a flash.",https://www.kickstarter.com/projects/1761670738/ring-shortcut-everything,http://iotlist.co/posts/ring-wearable-input-device-that-lets-you-control-anything,http://logbar.jp/ring/
http://iotlist.co/?page=19,Ringly: Smart jewelry and accessories,http://iotlist.co/posts/ringly-smart-jewelry-and-accessories,http://iotlist-production.s3-us-west-2.amazonaws.com/uploads/production/post_attachment/618/file/1_2.jpg,Ringly connects to your phone and sends you customized notifications through vibration and light.,https://ringly.com/,http://iotlist.co/posts/ringly-smart-jewelry-and-accessories,https://ringly.com/
http://iotlist.co/?page=20,Ringly: Smart jewelry and accessories,http://iotlist.co/posts/ringly-smart-jewelry-and-accessories,http://iotlist-production.s3-us-west-2.amazonaws.com/uploads/production/post_attachment/618/file/1_2.jpg,Ringly connects to your phone and sends you customized notifications through vibration and light.,https://ringly.com/,http://iotlist.co/posts/ringly-smart-jewelry-and-accessories,https://ringly.com/
http://iotlist.co/?page=6,Roku 3: Streaming media player,http://iotlist.co/posts/roku-3-streaming-media-player,http://iotlist-production.s3-us-west-2.amazonaws.com/uploads/production/post_attachment/961/file/51ewP-q28_L._SL1000_.jpg,"The team has been testing the new Sling TV service (awesome by the way) and it gave us a chance to develop a great appreciation for the Roku 3 streaming media player. It has just about everything a novice cord cutter needs to replace their cable tv subscription. Netflix, Amazon Prime, Hulu and Sling TV. The interface is very easy to navigate and the voice control is a very cool feature. If you are looking for a solid cable replacement Roku 3 could be your answer.",http://amzn.to/1CPxqkx,http://iotlist.co/posts/roku-3-streaming-media-player,https://www.roku.com/products/roku-3
http://iotlist.co/?page=23,RondoMotion: Motion sensor for your headphones,http://iotlist.co/posts/rondomotion-motion-sensor-for-your-headphones,http://iotlist-production.s3-us-west-2.amazonaws.com/uploads/production/post_attachment/514/file/xl_gallery_33e75ff09dd601bbe69f351039152189_p254_14_31333932363936383237323436.jpg,Bring your headphones to life with RondoMotion. The world's first wireless motion sensor for your headphones that makes every song feel like it‰Ûªs your own private concert.,https://grandst.com/beta/rondomotion,http://iotlist.co/posts/rondomotion-motion-sensor-for-your-headphones,http://www.rondomotion.com/
http://iotlist.co/?page=24,RondoMotion: Motion sensor for your headphones,http://iotlist.co/posts/rondomotion-motion-sensor-for-your-headphones,http://iotlist-production.s3-us-west-2.amazonaws.com/uploads/production/post_attachment/514/file/xl_gallery_33e75ff09dd601bbe69f351039152189_p254_14_31333932363936383237323436.jpg,Bring your headphones to life with RondoMotion. The world's first wireless motion sensor for your headphones that makes every song feel like it‰Ûªs your own private concert.,https://grandst.com/beta/rondomotion,http://iotlist.co/posts/rondomotion-motion-sensor-for-your-headphones,http://www.rondomotion.com/
http://iotlist.co/?page=11,Roost: Smart Battery,http://iotlist.co/posts/roost-smart-battery,http://iotlist-production.s3-us-west-2.amazonaws.com/uploads/production/post_attachment/890/file/just-roost-battery-solo.png,Smarten your smoke alarms with Roost. Roost smart battery delivers notifications to you wherever you are. This is not your average 9V battery.,https://www.kickstarter.com/projects/roost/the-roost-smart-battery-smarten-your-smoke-alarms,http://iotlist.co/posts/roost-smart-battery,http://smartroost.net/
http://iotlist.co/?page=4,Roost: Smart battery for smoke alarms,http://iotlist.co/posts/roost-smart-battery-for-smoke-alarms,http://iotlist-production.s3-us-west-2.amazonaws.com/uploads/production/post_attachment/980/file/61CVdRWqPrL._SL1500_.jpg,Roost is the affordable approach to connecting your smoke alarm. We had a chance to meet with the Roost team over the past few months and they have a unique perspective on making the smart home accessible to the mass market. The Roost smart battery is the first step in delivering that vision. For $35 consumers can connect any smoke alarm which will send notifications to smart devices when there is an emergency or when the battery is low.,http://amzn.to/1LAjCmQ,http://iotlist.co/posts/roost-smart-battery-for-smoke-alarms,http://www.smartroost.net/
http://iotlist.co/?page=15,runScribe: Wearable for the data-driven athlete,http://iotlist.co/posts/runscribe-wearable-for-the-data-driven-athlete,http://iotlist-production.s3-us-west-2.amazonaws.com/uploads/production/post_attachment/732/file/06a22e5eb332f29902ca2329e23026cd_large.png,"runScribe provides a 3D view of how you run. With your support, we can help athletes run smarter, longer, and with fewer injuries.",https://www.kickstarter.com/projects/1103510338/runscribe-wearable-for-the-data-driven-athlete,http://iotlist.co/posts/runscribe-wearable-for-the-data-driven-athlete,http://www.runscribe.com/
http://iotlist.co/?page=17,Runtastic Orbit: The 24-hour wearable,http://iotlist.co/posts/runtastic-orbit-the-24-hour-wearable,http://iotlist-production.s3-us-west-2.amazonaws.com/uploads/production/post_attachment/705/file/product-2626b2c14361afae0760acec9eb9a733.png,"Runtastic Orbit - the new, 24-hour wearable from Runtastic - provides you with reliable, round-the-clock tracking to help you get a better sense of your daily movements, personal habits and untapped potential.",https://www.runtastic.com/shop/usa/runtastic-orbit?utm_source=runtastic.com&utm_medium=button&utm_campaign=shop.runor1&utm_content=marketing_landingpage.orbit,http://iotlist.co/posts/runtastic-orbit-the-24-hour-wearable,https://www.runtastic.com/orbit
http://iotlist.co/?page=31,Sammy Screamer: Motion alarm,http://iotlist.co/posts/sammy-screamer-motion-alarm,http://iotlist-production.s3-us-west-2.amazonaws.com/uploads/production/post_attachment/321/file/SammyScreamer2.jpg,"Sammy is a movement sensor that connects to the BleepBleeps app. Place Sammy on an item that you want to monitor - like a door, a bag or a kid‰Ûªs buggy. Get a notification on your phone if the item moves.",http://bleepbleeps.com/,http://iotlist.co/posts/sammy-screamer-motion-alarm,http://bleepbleeps.com/
http://iotlist.co/?page=2,Samsung Galaxy View: Connected screen,http://iotlist.co/posts/samsung-galaxy-view-connected-screen,http://iotlist-production.s3-us-west-2.amazonaws.com/uploads/production/post_attachment/1024/file/81R9Ng6JakL._SL1500_.jpg,Samsung Galaxy View is a connected screen targeted at cord cutters and what TV will be in the future. Our team saw this device and feel in love as it hints towards what could be for those of us who do not have cable but want a screen built for our needs. The Galaxy View is the first device we have seen focused on rethinking the TV screen. We are very excited to try it out.,http://amzn.to/1jkv2Ab,http://iotlist.co/posts/samsung-galaxy-view-connected-screen,http://www.samsung.com/us/explore/galaxy-view-features-and-specs/
http://iotlist.co/,Samsung Galaxy View: Connected screen,http://iotlist.co/posts/samsung-galaxy-view-connected-screen,http://iotlist-production.s3-us-west-2.amazonaws.com/uploads/production/post_attachment/1024/file/81R9Ng6JakL._SL1500_.jpg,Samsung Galaxy View is a connected screen targeted at cord cutters and what TV will be in the future. Our team saw this device and feel in love as it hints towards what could be for those of us who do not have cable but want a screen built for our needs. The Galaxy View is the first device we have seen focused on rethinking the TV screen. We are very excited to try it out.,http://amzn.to/1jkv2Ab,http://iotlist.co/posts/samsung-galaxy-view-connected-screen,http://www.samsung.com/us/explore/galaxy-view-features-and-specs/
http://iotlist.co/?page=22,Samsung Gear Fit: Fitness tracker,http://iotlist.co/posts/samsung-gear-fit-fitness-tracker,http://iotlist-production.s3-us-west-2.amazonaws.com/uploads/production/post_attachment/534/file/samsung-galaxy-gear-fit-sam-gfitb-j2.jpg,The advanced curved Super AMOLED touchscreen display and interchangeable bands of Samsung Gear Fit make you look cool even during the most strenuous of activities.,http://www.amazon.com/Samsung-Gear-Fit-Fitness-Tracker/dp/B00JBJ3JBI,http://iotlist.co/posts/samsung-gear-fit-fitness-tracker,http://www.samsung.com/global/microsite/gear/gearfit_features.html
http://iotlist.co/?page=23,Samsung Gear Fit: Fitness tracker,http://iotlist.co/posts/samsung-gear-fit-fitness-tracker,http://iotlist-production.s3-us-west-2.amazonaws.com/uploads/production/post_attachment/534/file/samsung-galaxy-gear-fit-sam-gfitb-j2.jpg,The advanced curved Super AMOLED touchscreen display and interchangeable bands of Samsung Gear Fit make you look cool even during the most strenuous of activities.,http://www.amazon.com/Samsung-Gear-Fit-Fitness-Tracker/dp/B00JBJ3JBI,http://iotlist.co/posts/samsung-gear-fit-fitness-tracker,http://www.samsung.com/global/microsite/gear/gearfit_features.html
http://iotlist.co/,Samsung Gear VR: Virtual reality headset,http://iotlist.co/posts/samsung-gear-vr-virtual-reality-headset,http://iotlist-production.s3-us-west-2.amazonaws.com/uploads/production/post_attachment/1035/file/Samsung_VR.jpg,It took us a while to check out the Samsung Gear VR and it a fun device to play around with. It is still early days but you can see why VR has such a buzz. We like the feel of playing games and watching movies so far. But we can not wait till someone builds the app that showcases the full capability of these type of devices.,http://amzn.to/1pznFsH,http://iotlist.co/posts/samsung-gear-vr-virtual-reality-headset,http://amzn.to/1pznFsH
http://iotlist.co/?page=7,Satechi IQ Spectrum: Bluetooth lightbulb,http://iotlist.co/posts/satechi-iq-spectrum-bluetooth-lightbulb,http://iotlist-production.s3-us-west-2.amazonaws.com/uploads/production/post_attachment/943/file/51GLvkp3rsL._SL1000_.jpg,Bluetooth lightbulbs are great for those looking for their first smart home product to buy. They have easy setup and add functionality to something we use all the time in our home. Satechi IQ Spectrum is a great entry point into bluetooth lighting. You can control the light form your smart device and play with tons colors options.,http://www.amazon.com/gp/product/B00Q78T2M6/ref=as_li_qf_sp_asin_il_tl?ie=UTF8&camp=1789&creative=9325&creativeASIN=B00Q78T2M6&linkCode=as2&tag=iotlist-20&linkId=RR2H3LL4SVE24K4H,http://iotlist.co/posts/satechi-iq-spectrum-bluetooth-lightbulb,http://www.satechi.net/index.php/spectrum-led-bulb
http://iotlist.co/?page=7,Scout Alarm: Simple connected home security,http://iotlist.co/posts/scout-alarm-simple-connected-home-security,http://iotlist-production.s3-us-west-2.amazonaws.com/uploads/production/post_attachment/948/file/614gSFpnwJL._SL1500_.jpg,Scout is a product that address one of the main use cases for the connected home...Security. The system is very portable so it would be great for renters and those who live in smaller spaces. The design is better than most DYI security systems and allows you to buy the products a la carte if you like.,http://amzn.to/1IEZaO4,http://iotlist.co/posts/scout-alarm-simple-connected-home-security,https://www.scoutalarm.com/
http://iotlist.co/?page=33,Scout: Hassle-Free Home Security,http://iotlist.co/posts/scout-hassle-free-home-security,http://iotlist-production.s3-us-west-2.amazonaws.com/uploads/production/post_attachment/247/file/arctic-7c424fe904b0c5706de40846d20938da.jpg,Scout is a wireless alarm system that wants to bring a level of simplicity in the installation and use of a security system for your home or office.,https://www.scoutalarm.com/preorder/details,http://iotlist.co/posts/scout-hassle-free-home-security,https://www.scoutalarm.com/
http://iotlist.co/?page=8,Sengled Pulse: LED light + wireless speakers,http://iotlist.co/posts/sengled-pulse-led-light-wireless-speakers,http://iotlist-production.s3-us-west-2.amazonaws.com/uploads/production/post_attachment/933/file/candy_apple_w.jpg,Pluse is a smart bulb that has a JBL multi-channel stereo wireless speaker hidden within. You can simply screw the bulb into your existing lamp socket and control with your iOS or Android device. This is a great idea for those who rent and want to save space and create a modular smart home.,http://amzn.to/1HFIsx4,http://iotlist.co/posts/sengled-pulse-led-light-wireless-speakers,http://www.sengled.com/product/pulse
http://iotlist.co/?page=17,Sense: Track your sleep behavior,http://iotlist.co/posts/sense-track-your-sleep-behavior,http://iotlist-production.s3-us-west-2.amazonaws.com/uploads/production/post_attachment/682/file/a38dd71049c7994fdb36359981c4f228_large.jpg,"Sense is a simple system that tracks your sleep behavior, monitors the environment of your bedroom and reinvents the alarm.",https://www.kickstarter.com/projects/hello/sense-know-more-sleep-better,http://iotlist.co/posts/sense-track-your-sleep-behavior,http://hello.is/
http://iotlist.co/?page=19,Sensibo: Make any air conditioner smart,http://iotlist.co/posts/sensibo-make-any-air-conditioner-smart,http://iotlist-production.s3-us-west-2.amazonaws.com/uploads/production/post_attachment/628/file/20140515083743-sensibo_with_sunglasses.jpg,"Sensibo is a tiny device that connects air conditioners to the internet.It can be used with any A/C that has a remote control. It comes with a free app for iPhone, Android and Pebble.",https://www.indiegogo.com/projects/sensibo-make-any-air-conditioner-smart,http://iotlist.co/posts/sensibo-make-any-air-conditioner-smart,http://www.sensibo.com/
http://iotlist.co/?page=20,Sensibo: Make any air conditioner smart,http://iotlist.co/posts/sensibo-make-any-air-conditioner-smart,http://iotlist-production.s3-us-west-2.amazonaws.com/uploads/production/post_attachment/628/file/20140515083743-sensibo_with_sunglasses.jpg,"Sensibo is a tiny device that connects air conditioners to the internet.It can be used with any A/C that has a remote control. It comes with a free app for iPhone, Android and Pebble.",https://www.indiegogo.com/projects/sensibo-make-any-air-conditioner-smart,http://iotlist.co/posts/sensibo-make-any-air-conditioner-smart,http://www.sensibo.com/
http://iotlist.co/?page=37,Sensoria Fitness: Wearables reinvented,http://iotlist.co/posts/sensoria-fitness-wearables-reinvented,http://iotlist-production.s3-us-west-2.amazonaws.com/uploads/production/post_attachment/248/file/SmartSocks.jpg,"Imagine a super accurate fitness tracker that tells you how far and how fast. Now imagine a development toolkit, a t-shirt, a sport bra and a pair of smart socks that also tell you how WELL you walk, run and exercise.",http://store.sensoriafitness.com/,http://iotlist.co/posts/sensoria-fitness-wearables-reinvented,http://store.sensoriafitness.com/
http://iotlist.co/?page=8,Sentri: Home monitoring and automation,http://iotlist.co/posts/sentri-home-monitoring-and-automation,http://iotlist-production.s3-us-west-2.amazonaws.com/uploads/production/post_attachment/928/file/monitor_dog.jpg,"Sentri is a complete home monitoring and automation solution in one beautiful display. Sentri adapts to your home and delivers personalized alerts along with a live HD video feed straight to your smartphone, no matter where you are.",http://amzn.to/1IvFZGt,http://iotlist.co/posts/sentri-home-monitoring-and-automation,http://sentri.me/
http://iotlist.co/?page=12,ShutterEaze: Automate your plantation shutters,http://iotlist.co/posts/shuttereaze-automate-your-plantation-shutters,http://iotlist-production.s3-us-west-2.amazonaws.com/uploads/production/post_attachment/840/file/pic-01.jpg,ShutterEaze makes it easy for anyone to add remote control functionality and automate their existing interior plantation shutters.,https://www.kickstarter.com/projects/2070556083/shuttereaze-home-automation-for-your-plantation-sh/,http://iotlist.co/posts/shuttereaze-automate-your-plantation-shutters,http://shuttereaze.com/
http://iotlist.co/?page=11,ShutterEaze: Automate your plantation shutters,http://iotlist.co/posts/shuttereaze-automate-your-plantation-shutters,http://iotlist-production.s3-us-west-2.amazonaws.com/uploads/production/post_attachment/840/file/pic-01.jpg,ShutterEaze makes it easy for anyone to add remote control functionality and automate their existing interior plantation shutters.,https://www.kickstarter.com/projects/2070556083/shuttereaze-home-automation-for-your-plantation-sh/,http://iotlist.co/posts/shuttereaze-automate-your-plantation-shutters,http://shuttereaze.com/
http://iotlist.co/?page=3,Singlecue: Gesture control for connected home,http://iotlist.co/posts/singlecue-gesture-control-for-connected-home,http://iotlist-production.s3-us-west-2.amazonaws.com/uploads/production/post_attachment/995/file/61ANe4900qL._SL1500_.jpg,"Singlecue allows you to control your connected home with gestures. We saw a demo of a early version of Singlecue and thought the concept was interesting. The connected home will need multiple ways of interacting including voice, presence and gesture.",http://amzn.to/1LD99sV,http://iotlist.co/posts/singlecue-gesture-control-for-connected-home,http://singlecue.com/
http://iotlist.co/?page=24,SITU: Smart food nutrition scale,http://iotlist.co/posts/situ-smart-food-nutrition-scale,http://iotlist-production.s3-us-west-2.amazonaws.com/uploads/production/post_attachment/1018/file/scale_1-800x400.png,SITU is a simple food scale with a Bluetooth chip that talks to your iPad. You can place virtually any food item on SITU and view the exact nutrition information for that amount of food on the companion SITU app.,http://situscale.com/product/situ/,http://iotlist.co/posts/situ-smart-food-nutrition-scale,http://situscale.com/
http://iotlist.co/?page=25,SITU: Smart food nutrition scale,http://iotlist.co/posts/situ-smart-food-nutrition-scale,http://iotlist-production.s3-us-west-2.amazonaws.com/uploads/production/post_attachment/1018/file/scale_1-800x400.png,SITU is a simple food scale with a Bluetooth chip that talks to your iPad. You can place virtually any food item on SITU and view the exact nutrition information for that amount of food on the companion SITU app.,http://situscale.com/product/situ/,http://iotlist.co/posts/situ-smart-food-nutrition-scale,http://situscale.com/
http://iotlist.co/?page=16,Skully: Connected Motorcycle Helmet,http://iotlist.co/posts/skully-connected-motorcycle-helmet,http://iotlist-production.s3-us-west-2.amazonaws.com/uploads/production/post_attachment/720/file/download.png,"Motorcycle helmet that is connected with heads-up display, rearview camera & GPS navigation.",http://store.skully.com/,http://iotlist.co/posts/skully-connected-motorcycle-helmet,http://www.skullysystems.com/
http://iotlist.co/?page=27,Skulpt Aim: Body composition & muscle quality analyzer,http://iotlist.co/posts/skulpt-aim-body-composition-muscle-quality-analyzer,http://iotlist-production.s3-us-west-2.amazonaws.com/uploads/production/post_attachment/414/file/skulpt-aim.png,"Aim is an innovative device for measuring body composition and analyzing individual muscles. Simply place the device on the muscle you want to measure, and instantly get the fat percentage and overall muscle quality for that body part.",http://www.skulpt.me/order.html,http://iotlist.co/posts/skulpt-aim-body-composition-muscle-quality-analyzer,http://www.skulpt.me/
http://iotlist.co/?page=28,Skulpt Aim: Body composition & muscle quality analyzer,http://iotlist.co/posts/skulpt-aim-body-composition-muscle-quality-analyzer,http://iotlist-production.s3-us-west-2.amazonaws.com/uploads/production/post_attachment/414/file/skulpt-aim.png,"Aim is an innovative device for measuring body composition and analyzing individual muscles. Simply place the device on the muscle you want to measure, and instantly get the fat percentage and overall muscle quality for that body part.",http://www.skulpt.me/order.html,http://iotlist.co/posts/skulpt-aim-body-composition-muscle-quality-analyzer,http://www.skulpt.me/
http://iotlist.co/?page=25,SkyBell: Smart video doorbell,http://iotlist.co/posts/skybell-smart-video-doorbell,http://iotlist-production.s3-us-west-2.amazonaws.com/uploads/production/post_attachment/466/file/fp-iphone-app-device-1118.jpg,"SkyBell features a video camera, exclusive motion sensor, microphone and a speaker that allows you to see, hear and speak to your visitor from an iOS or Android mobile device.",http://www.skybell.com/product/skybell-device/,http://iotlist.co/posts/skybell-smart-video-doorbell,http://www.skybell.com/
http://iotlist.co/?page=26,SkyBell: Smart video doorbell,http://iotlist.co/posts/skybell-smart-video-doorbell,http://iotlist-production.s3-us-west-2.amazonaws.com/uploads/production/post_attachment/466/file/fp-iphone-app-device-1118.jpg,"SkyBell features a video camera, exclusive motion sensor, microphone and a speaker that allows you to see, hear and speak to your visitor from an iOS or Android mobile device.",http://www.skybell.com/product/skybell-device/,http://iotlist.co/posts/skybell-smart-video-doorbell,http://www.skybell.com/
http://iotlist.co/?page=13,Skydrop: Revolutionary sprinkler controller,http://iotlist.co/posts/skydrop-revolutionary-sprinkler-controller,http://iotlist-production.s3-us-west-2.amazonaws.com/uploads/production/post_attachment/817/file/Skydrop-Sprinkler-Controller-02.jpg,"The skydrop controller is built with the planet, and you, in mind. It is designed to not only save water, but to save you money.",http://www.skydrop.com/b/product/skydrop-sprinkler-controller/,http://iotlist.co/posts/skydrop-revolutionary-sprinkler-controller,http://www.skydrop.com/
http://iotlist.co/?page=21,Skylock: Connected bike lock,http://iotlist.co/posts/skylock-connected-bike-lock,http://iotlist-production.s3-us-west-2.amazonaws.com/uploads/production/post_attachment/566/file/2.png,"Skylock connects with your mobile device to provide a more safe, secure, and accessible biking experience.",http://amzn.to/1LNDp2v,http://iotlist.co/posts/skylock-connected-bike-lock,https://skylock.cc/
http://iotlist.co/?page=22,Skylock: Connected bike lock,http://iotlist.co/posts/skylock-connected-bike-lock,http://iotlist-production.s3-us-west-2.amazonaws.com/uploads/production/post_attachment/566/file/2.png,"Skylock connects with your mobile device to provide a more safe, secure, and accessible biking experience.",http://amzn.to/1LNDp2v,http://iotlist.co/posts/skylock-connected-bike-lock,https://skylock.cc/
