url,Title link,Title link_link,Mediainner image,Description,Buy link_link,Video link_link,Website link_link
http://iotlist.co/?page=36,Melon: A Headband and Mobile App to Measure Your Focus,http://iotlist.co/posts/melon-a-headband-and-mobile-app-to-measure-your-focus,http://iotlist-production.s3-us-west-2.amazonaws.com/uploads/production/post_attachment/481/file/LargeHeadband.png,Gain insight into how your mind works by tracking your focus during any activity you choose. Understand yourself. Learn differently.,http://www.thinkmelon.com/,http://iotlist.co/posts/melon-a-headband-and-mobile-app-to-measure-your-focus,http://www.usemelon.com/
http://iotlist.co/?page=38,MEMI: Wearable tech for women,http://iotlist.co/posts/memi-wearable-tech-for-women,http://iotlist-production.s3-us-west-2.amazonaws.com/uploads/production/post_attachment/349/file/memi-standalone-900.jpg,"MEMI is a chic iPhone-compatible smartbracelet that notifies you of important phone calls, text messages & calendar alerts.",http://www.hellomemi.com/pre-order.html,http://iotlist.co/posts/memi-wearable-tech-for-women,http://www.hellomemi.com/index.html
http://iotlist.co/?page=35,MetaPro AR Glasses: The first holographic interface,http://iotlist.co/posts/metapro-ar-glasses-the-first-holographic-interface,http://iotlist-production.s3-us-west-2.amazonaws.com/uploads/production/post_attachment/227/file/MetaPro.png,"Wearables startup Meta has revealed its latest headset, the MetaPro, a consumer version of its Meta 1 developer device that amps up Google Glass by overlaying full digital graphics over the real world.",https://www.spaceglasses.com/buy,http://iotlist.co/posts/metapro-ar-glasses-the-first-holographic-interface,https://www.spaceglasses.com/
http://iotlist.co/?page=31,MetaWatch STRATA: Smartwatch,http://iotlist.co/posts/metawatch-strata-smartwatch,http://iotlist-production.s3-us-west-2.amazonaws.com/uploads/production/post_attachment/320/file/strata_tangerine_0.png,"MetaWatch is designed to make things simple, so it's not a wearable computer or a wrist-top smartphone. And it doesn't try to be. Instead, it's an elegantly simple display that makes staying up-to-date convenient and unobtrusive.",http://www.bestbuy.com/site/strata-watch-for-apple-174-iphone-174-4s-and-5-and-select-android-mobile-phones/2686675.p?id=1219075851047&skuId=2686675&st=metawatch&cp=1&lp=5,http://iotlist.co/posts/metawatch-strata-smartwatch,http://www.metawatch.com/collection/strata
http://iotlist.co/?page=25,MiCoach: Smart run watch,http://iotlist.co/posts/micoach-smart-run-watch,http://iotlist-production.s3-us-west-2.amazonaws.com/uploads/production/post_attachment/472/file/G76792_01.jpeg,"The miCoach SMART RUN watch delivers an advanced, intuitive blend of coaching and performance data designed to help serious runners maximize training every time you lace up your shoes. Clean and simple, it delivers a strapless continuous heart rate, GPS, Bluetooth 4.0, wireless music player, WLAN and a color touch screen.",http://www.adidas.com/us/product/training-mi-coach-smart-run-watch/AG042?cid=G76792&breadcrumb=1z13071Z1z11zrfZ1z11vmg,http://iotlist.co/posts/micoach-smart-run-watch,https://micoach.adidas.com/us/smartrun
http://iotlist.co/?page=26,MiCoach: Smart run watch,http://iotlist.co/posts/micoach-smart-run-watch,http://iotlist-production.s3-us-west-2.amazonaws.com/uploads/production/post_attachment/472/file/G76792_01.jpeg,"The miCoach SMART RUN watch delivers an advanced, intuitive blend of coaching and performance data designed to help serious runners maximize training every time you lace up your shoes. Clean and simple, it delivers a strapless continuous heart rate, GPS, Bluetooth 4.0, wireless music player, WLAN and a color touch screen.",http://www.adidas.com/us/product/training-mi-coach-smart-run-watch/AG042?cid=G76792&breadcrumb=1z13071Z1z11zrfZ1z11vmg,http://iotlist.co/posts/micoach-smart-run-watch,https://micoach.adidas.com/us/smartrun
http://iotlist.co/?page=11,Mimo: Smart baby monitoring,http://iotlist.co/posts/mimo-smart-baby-monitoring,http://iotlist-production.s3-us-west-2.amazonaws.com/uploads/production/post_attachment/889/file/71h9OXkKfaL._SX522_.jpg,"Stay connected with the Mimo Baby Monitor. Get real-time audio and insights about your baby‰Ûªs sleep activity, right on your smart device, from anywhere in the world.",http://amzn.to/1agq8Al,http://iotlist.co/posts/mimo-smart-baby-monitoring,http://mimobaby.com/
http://iotlist.co/?page=21,Mio Alpha: Heart rate band,http://iotlist.co/posts/mio-alpha-heart-rate-band,http://iotlist-production.s3-us-west-2.amazonaws.com/uploads/production/post_attachment/552/file/trainwithheart.jpg,"From runners to cyclists, triathletes and beyond, Mio‰Ûªs continuous heart rate wristbands and watches are designed to help you reach your fitness goals.",http://www.mioglobal.com/Shop/Department.aspx?DeptID=1&&,http://iotlist.co/posts/mio-alpha-heart-rate-band,http://www.mioglobal.com/Default.aspx
http://iotlist.co/?page=22,Mio Alpha: Heart rate band,http://iotlist.co/posts/mio-alpha-heart-rate-band,http://iotlist-production.s3-us-west-2.amazonaws.com/uploads/production/post_attachment/552/file/trainwithheart.jpg,"From runners to cyclists, triathletes and beyond, Mio‰Ûªs continuous heart rate wristbands and watches are designed to help you reach your fitness goals.",http://www.mioglobal.com/Shop/Department.aspx?DeptID=1&&,http://iotlist.co/posts/mio-alpha-heart-rate-band,http://www.mioglobal.com/Default.aspx
http://iotlist.co/?page=6,Misfit Bolt: Bluetooth smart bulb,http://iotlist.co/posts/misfit-bolt-bluetooth-smart-bulb,http://iotlist-production.s3-us-west-2.amazonaws.com/uploads/production/post_attachment/956/file/61yJ8WjlMcL._SL1500_.jpg,Simple setup is becoming a theme for smart home products. Misfit Bolt smart bulb achieves simple setup by leveraging bluetooth technology. Bluetooth is the same technology that makes portable speakers super easy to use. We received an early version of the Misfit bulb and it delivers on a the promise of a simple connected light bulb. Because it is based on bluetooth your phone must be in range for it to work but from what we found our phone is always near by :),http://amzn.to/1MYEbvB,http://iotlist.co/posts/misfit-bolt-bluetooth-smart-bulb,http://misfit.com/products/bolt
http://iotlist.co/?page=38,Misfit Wearables: Shine,http://iotlist.co/posts/misfit-wearables-shine,http://iotlist-production.s3-us-west-2.amazonaws.com/uploads/production/post_attachment/139/file/01_shine_grey_2048x2048.jpg,An elegant personal activity tracker. Works with the Shine app. Sport Band and Clasp included.,http://store.misfitwearables.com/products/misfit-shine,http://iotlist.co/posts/misfit-wearables-shine,http://www.misfitwearables.com/#home
http://iotlist.co/?page=3,Misfit Wearables: Shine 2,http://iotlist.co/posts/misfit-wearables-shine-2,http://iotlist-production.s3-us-west-2.amazonaws.com/uploads/production/post_attachment/1002/file/71VHSppJ62L._SL1500_.jpg,"Shine 2 is an advanced, premium activity and sleep monitor made by the team at Misfit. It is a great device for someone who is motivated to meet their health and fitness goals but does not care to wear a smart watch. One thing that is very cool about Shine 2 is that you can control smart home devices like Bolt connected lights using the device.",http://amzn.to/1GVhcKk,http://iotlist.co/posts/misfit-wearables-shine-2,http://misfit.com/products/shine2
http://iotlist.co/?page=30,Mojio: Connect your car to your favorite things,http://iotlist.co/posts/mojio-connect-your-car-to-your-favorite-things,http://iotlist-production.s3-us-west-2.amazonaws.com/uploads/production/post_attachment/344/file/555073_705420392804225_859658518_n.jpg,"MOJIO sends and receives data to and from your car in real time. That data is ‰ÛÏtranslated‰Ûù and fed to the app on your smartphone in plain English, giving you information about your car and its status while keeping you connected to your favorite people, places and things.",http://app.moj.io/store,http://iotlist.co/posts/mojio-connect-your-car-to-your-favorite-things,http://www.moj.io/
http://iotlist.co/?page=17,Monolyth: Control your AC with your Smartphone,http://iotlist.co/posts/monolyth-control-your-ac-with-your-smartphone,http://iotlist-production.s3-us-west-2.amazonaws.com/uploads/production/post_attachment/675/file/kickstarter-W_9_copy_18.jpg,The Monolyth makes your AC unit smart for your comfort and energy savings.,http://igg.me/at/mnlth,http://iotlist.co/posts/monolyth-control-your-ac-with-your-smartphone,http://monolyth.co/
http://iotlist.co/?page=26,Moov: Your connected personal coach,http://iotlist.co/posts/moov-your-connected-personal-coach,http://iotlist-production.s3-us-west-2.amazonaws.com/uploads/production/post_attachment/450/file/dc6fw8twkzvauxl8fmvz.png,Wear it - mount it - hear it. 5 sports included to get started. Real-time interactive coaching. Performance tracking. Injury prevention. Form monitoring. 3D Motion sensing. Waterproof.,https://moov.cc/preorder,http://iotlist.co/posts/moov-your-connected-personal-coach,http://preorder.moov.cc/
http://iotlist.co/?page=27,Moov: Your connected personal coach,http://iotlist.co/posts/moov-your-connected-personal-coach,http://iotlist-production.s3-us-west-2.amazonaws.com/uploads/production/post_attachment/450/file/dc6fw8twkzvauxl8fmvz.png,Wear it - mount it - hear it. 5 sports included to get started. Real-time interactive coaching. Performance tracking. Injury prevention. Form monitoring. 3D Motion sensing. Waterproof.,https://moov.cc/preorder,http://iotlist.co/posts/moov-your-connected-personal-coach,http://preorder.moov.cc/
http://iotlist.co/?page=13,MOTA SmartRing: Connectivity at your fingertips,http://iotlist.co/posts/mota-smartring-connectivity-at-your-fingertips,http://iotlist-production.s3-us-west-2.amazonaws.com/uploads/production/post_attachment/814/file/MOTA-Ring-FB-BLACK-WShadow-webrevised.png,"MOTA SmartRing keeps you connected with who and what matter most. Calls, texts, email and social networking in style.",https://www.kickstarter.com/projects/mota/mota-smartring-connectivity-at-your-fingertips,http://iotlist.co/posts/mota-smartring-connectivity-at-your-fingertips,http://www.mota.com/
http://iotlist.co/?page=16,Moxie: Showerhead with wireless speaker,http://iotlist.co/posts/moxie-showerhead-with-wireless-speaker,http://iotlist-production.s3-us-west-2.amazonaws.com/uploads/production/post_attachment/716/file/41iEh3z8jcL._SY300_.jpg,"Your music. Your shower. Your time. To chill out. To sing. Refresh. Energize. Escape. The Moxie showerhead + wireless speaker delivers up to 7 hours of music, news and more by pairing wirelessly with your device enabled with Bluetoothå¨ technology. Just you + water + clean, clear sound.",http://www.amazon.com/K-9245-CP-Showerhead-Wireless-Speaker-Polished/dp/B00A46X48A,http://iotlist.co/posts/moxie-showerhead-with-wireless-speaker,http://www.us.kohler.com/us/Bathroom-New-Products-Moxie%E2%84%A2-Showerhead-+-Wireless-Speaker/content/CNT16200089.htm
http://iotlist.co/?page=9,Mr. Coffee: Smart coffeemaker,http://iotlist.co/posts/mr-coffee-smart-coffeemaker,http://iotlist-production.s3-us-west-2.amazonaws.com/uploads/production/post_attachment/918/file/372.jpg,"Enabled with WeMo, the Mr. Coffee 10-Cup Smart Optimal Brew Coffeemaker makes it easy to schedule, monitor, and modify your brew from anywhere. Sleep in a little longer by setting up a brewing schedule in advance.",http://amzn.to/1Cs4YJU,http://iotlist.co/posts/mr-coffee-smart-coffeemaker,http://www.belkin.com/us/F7C050-Belkin/p/P-F7C050/
http://iotlist.co/?page=25,Musaic: Wireless HiFi music system,http://iotlist.co/posts/musaic-wireless-hifi-music-system,http://iotlist-production.s3-us-west-2.amazonaws.com/uploads/production/post_attachment/480/file/9c4894_c32f49b960db41619c63b8651544cfd8.jpg_srz_p_446_168_75_22_0.50_1.jpeg,"The Musaic wireless HiFi system plays music from Apple and Android devices, Mac and PC, UPnP/DNLA servers and NAS drives. Musaic can play from Bluetooth or WiFi for the best possible sound quality and is compatible with iTunes and Windows Media Player.",https://www.kickstarter.com/projects/1112831839/musaic-wireless-hifi-music-system-your-music-your,http://iotlist.co/posts/musaic-wireless-hifi-music-system,http://www.musaic.com/
http://iotlist.co/?page=26,Musaic: Wireless HiFi music system,http://iotlist.co/posts/musaic-wireless-hifi-music-system,http://iotlist-production.s3-us-west-2.amazonaws.com/uploads/production/post_attachment/480/file/9c4894_c32f49b960db41619c63b8651544cfd8.jpg_srz_p_446_168_75_22_0.50_1.jpeg,"The Musaic wireless HiFi system plays music from Apple and Android devices, Mac and PC, UPnP/DNLA servers and NAS drives. Musaic can play from Bluetooth or WiFi for the best possible sound quality and is compatible with iTunes and Windows Media Player.",https://www.kickstarter.com/projects/1112831839/musaic-wireless-hifi-music-system-your-music-your,http://iotlist.co/posts/musaic-wireless-hifi-music-system,http://www.musaic.com/
http://iotlist.co/?page=34,Muse: The brain sensing headband,http://iotlist.co/posts/muse-the-brain-sensing-headband,http://iotlist-production.s3-us-west-2.amazonaws.com/uploads/production/post_attachment/221/file/carousel1.png,"Physical and cognitive well-being is important but if emotions are controlling you, both of those are impacted significantly. Muse helps you manage stress so it doesn‰Ûªt get the better of you.",https://www.shoplocket.com/products/PaxCP-reserve-your-muse,http://iotlist.co/posts/muse-the-brain-sensing-headband,http://www.interaxon.ca/muse/index.php
http://iotlist.co/?page=6,MUZO Cobblestone: Wireless music receiver,http://iotlist.co/posts/muzo-cobblestone-wireless-music-receiver,http://iotlist-production.s3-us-west-2.amazonaws.com/uploads/production/post_attachment/965/file/14293186730.jpg,Creating a better music experience by leveraging connectivity is a great value proposition in the smart home. Sonos did a great job in building and delivering a great product this serves this purpose. MUZO is a simple way to control music in your home.,http://amzn.to/1EOUBmL,http://iotlist.co/posts/muzo-cobblestone-wireless-music-receiver,http://www.muzohifi.com/
http://iotlist.co/?page=23,My N3RD: Connect and control anything from anywhere,http://iotlist.co/posts/my-n3rd-connect-and-control-anything-from-anywhere,http://iotlist-production.s3-us-west-2.amazonaws.com/uploads/production/post_attachment/528/file/My_N3RD_enclosure_order.png,"My N3RD (Pronounced Nerd) is a revolutionary Wi-Fi product that allows you to control any device from your Smart Phone. No internet or router required. My N3RD can control every gadget, vehicle and appliance you own. It works with the My N3RD app to upgrade ANY switch into a wireless controlled, programmable, and automatic smart switch, updating all of your devices into intelligent connected ones.",http://www.myn3rd.com/shop/,http://iotlist.co/posts/my-n3rd-connect-and-control-anything-from-anywhere,http://www.myn3rd.com/
http://iotlist.co/?page=24,My N3RD: Connect and control anything from anywhere,http://iotlist.co/posts/my-n3rd-connect-and-control-anything-from-anywhere,http://iotlist-production.s3-us-west-2.amazonaws.com/uploads/production/post_attachment/528/file/My_N3RD_enclosure_order.png,"My N3RD (Pronounced Nerd) is a revolutionary Wi-Fi product that allows you to control any device from your Smart Phone. No internet or router required. My N3RD can control every gadget, vehicle and appliance you own. It works with the My N3RD app to upgrade ANY switch into a wireless controlled, programmable, and automatic smart switch, updating all of your devices into intelligent connected ones.",http://www.myn3rd.com/shop/,http://iotlist.co/posts/my-n3rd-connect-and-control-anything-from-anywhere,http://www.myn3rd.com/
http://iotlist.co/?page=31,Narrative: Connected digital camera clip,http://iotlist.co/posts/narrative-connected-digital-camera-clip,http://iotlist-production.s3-us-west-2.amazonaws.com/uploads/production/post_attachment/994/file/61ZO6ac4IYL._SL1500_.jpg,The Narrative Clip is a tiny camera and GPS that you clip on and wear. It‰Ûªs an entirely new kind of digital camera with no controls.,http://amzn.to/1WQv0yS,http://iotlist.co/posts/narrative-connected-digital-camera-clip,http://getnarrative.com/
http://iotlist.co/?page=32,Narrative: Connected digital camera clip,http://iotlist.co/posts/narrative-connected-digital-camera-clip,http://iotlist-production.s3-us-west-2.amazonaws.com/uploads/production/post_attachment/994/file/61ZO6ac4IYL._SL1500_.jpg,The Narrative Clip is a tiny camera and GPS that you clip on and wear. It‰Ûªs an entirely new kind of digital camera with no controls.,http://amzn.to/1WQv0yS,http://iotlist.co/posts/narrative-connected-digital-camera-clip,http://getnarrative.com/
http://iotlist.co/?page=16,Navdy: Connected driving experience,http://iotlist.co/posts/navdy-connected-driving-experience,http://iotlist-production.s3-us-west-2.amazonaws.com/uploads/production/post_attachment/713/file/navdy_front_directions.jpg,Navdy's transparent Head-Up Display (HUD) projects information as if it's floating six feet in front of you. In the car you already have.,https://www.navdy.com/,http://iotlist.co/posts/navdy-connected-driving-experience,https://www.navdy.com/
http://iotlist.co/?page=8,NEEO: Smart home remote,http://iotlist.co/posts/neeo-smart-home-remote,http://iotlist-production.s3-us-west-2.amazonaws.com/uploads/production/post_attachment/1029/file/51LT0BfEONL._SL1200_.jpg,NEEO is a smart home automation system. It‰Ûªs the simplest way to connect and control all the devices in your home.,http://amzn.to/1NgEa06,http://iotlist.co/posts/neeo-smart-home-remote,http://www.neeo.com/
http://iotlist.co/?page=23,Nekomimi: Brainwave cat ears,http://iotlist.co/posts/nekomimi-brainwave-cat-ears,http://iotlist-production.s3-us-west-2.amazonaws.com/uploads/production/post_attachment/508/file/necomimi-mailer_large_large_1_.png,Necomimi is the new communication tool that augments the human bodies and abilities. This cat‰Ûªs ear shaped machine utilizes brainwaves and expresses your emotional state before you start talking.,http://store.necomimi.com/,http://iotlist.co/posts/nekomimi-brainwave-cat-ears,http://necomimi.com/
http://iotlist.co/?page=24,Nekomimi: Brainwave cat ears,http://iotlist.co/posts/nekomimi-brainwave-cat-ears,http://iotlist-production.s3-us-west-2.amazonaws.com/uploads/production/post_attachment/508/file/necomimi-mailer_large_large_1_.png,Necomimi is the new communication tool that augments the human bodies and abilities. This cat‰Ûªs ear shaped machine utilizes brainwaves and expresses your emotional state before you start talking.,http://store.necomimi.com/,http://iotlist.co/posts/nekomimi-brainwave-cat-ears,http://necomimi.com/
http://iotlist.co/?page=4,Nest Cam: Connected camera,http://iotlist.co/posts/nest-cam-connected-camera,http://iotlist-production.s3-us-west-2.amazonaws.com/uploads/production/post_attachment/979/file/nest-cam.jpg,Nest Cam is the updated version of Dropcam Pro. We had a chance to test of the Nest Cam and it is a good update to the category leading Dropcam product. It was really exciting to use the new Nest app. The app is evolving into a true representation of home control. The app highlights two main use cases for consumers which are security and energy management. They app experience is based on a device by room paradigm which will all you to extend your home control as you add more devices.,http://amzn.to/1HbDrke,http://iotlist.co/posts/nest-cam-connected-camera,https://nest.com/camera/meet-nest-cam/
http://iotlist.co/?page=28,Nest Protect: Smart Smoke and Carbon Monoxide (CO) Alarm,http://iotlist.co/posts/nest-protect-smart-smoke-and-carbon-monoxide-co-alarm,http://iotlist-production.s3-us-west-2.amazonaws.com/uploads/production/post_attachment/405/file/protect-front-white-640x628.jpg,"Safety shouldn‰Ûªt be annoying. We all know why smoke alarms are torn off the ceiling or missing batteries: because every time you make stir-fry, the smoke alarm cries wolf. Or just as you‰Ûªre falling asleep, you hear a low-battery chirp. They‰Ûªve become annoying. And that‰Ûªs a safety issue. According to the National Fire Protection Association (NFPA), almost two-thirds of US home fire deaths happened in homes with no smoke alarm or no working smoke alarm. So we made something new. Meet the Nest Protect smoke and carbon monoxide (CO) alarm.",https://store.nest.com/product/smoke-co-alarm/,http://iotlist.co/posts/nest-protect-smart-smoke-and-carbon-monoxide-co-alarm,https://nest.com/smoke-co-alarm/life-with-nest-protect/
http://iotlist.co/?page=29,Nest Protect: Smart Smoke and Carbon Monoxide (CO) Alarm,http://iotlist.co/posts/nest-protect-smart-smoke-and-carbon-monoxide-co-alarm,http://iotlist-production.s3-us-west-2.amazonaws.com/uploads/production/post_attachment/405/file/protect-front-white-640x628.jpg,"Safety shouldn‰Ûªt be annoying. We all know why smoke alarms are torn off the ceiling or missing batteries: because every time you make stir-fry, the smoke alarm cries wolf. Or just as you‰Ûªre falling asleep, you hear a low-battery chirp. They‰Ûªve become annoying. And that‰Ûªs a safety issue. According to the National Fire Protection Association (NFPA), almost two-thirds of US home fire deaths happened in homes with no smoke alarm or no working smoke alarm. So we made something new. Meet the Nest Protect smoke and carbon monoxide (CO) alarm.",https://store.nest.com/product/smoke-co-alarm/,http://iotlist.co/posts/nest-protect-smart-smoke-and-carbon-monoxide-co-alarm,https://nest.com/smoke-co-alarm/life-with-nest-protect/
http://iotlist.co/?page=30,Nest Thermostat: The learning thermostat,http://iotlist.co/posts/nest-thermostat-the-learning-thermostat,http://iotlist-production.s3-us-west-2.amazonaws.com/uploads/production/post_attachment/346/file/51fIuVoVTXL._SX466_.jpg,"Nest Learning Thermostat learns your schedule, programs itself and can be controlled from your phone. Teach it well and the Nest Thermostat can lower your heating and cooling bills up to 20%.",https://store.nest.com/product/thermostat/,http://iotlist.co/posts/nest-thermostat-the-learning-thermostat,https://nest.com/thermostat/life-with-nest-thermostat/
http://iotlist.co/?page=4,Netatmo Welcome: Smart camera with face recognition,http://iotlist.co/posts/netatmo-welcome-smart-camera-with-face-recognition,http://iotlist-production.s3-us-west-2.amazonaws.com/uploads/production/post_attachment/982/file/71IBZwaFPwL._SL1500_.jpg,Connected security camera's are one of the top selling categories in smarthome and IoT. Netatmo Welcome enters the market with the promise of adding face recognition to allow you to know who is in your house. It also has SD local storage so you do not have to push all the video to the cloud.,http://amzn.to/1fheQhQ,http://iotlist.co/posts/netatmo-welcome-smart-camera-with-face-recognition,https://www.netatmo.com/en-US/product/camera
http://iotlist.co/?page=38,Netatmo: Urban Weather Station,http://iotlist.co/posts/netatmo-urban-weather-station,http://iotlist-production.s3-us-west-2.amazonaws.com/uploads/production/post_attachment/205/file/1_h.jpg,"Personal indoor/outdoor Weather Station and free App lets users monitor the quality of their micro and macro living environments, accurately tracking and monitoring both Weather and Air Quality.",https://shop.netatmo.com/usd_en,http://iotlist.co/posts/netatmo-urban-weather-station,http://www.netatmo.com/
http://iotlist.co/?page=24,NetCam: HD Wi-Fi camera with night vision,http://iotlist.co/posts/netcam-hd-wi-fi-camera-with-night-vision,http://iotlist-production.s3-us-west-2.amazonaws.com/uploads/production/post_attachment/492/file/belkin-bk-F7D7602-1.jpg,"NetCam HD allow you to keep tabs on kids or pets from your smartphone or tablet--it also allows you to see all the action in vibrant 720p HD video. Ideal for anyone who has kids, pets, or grandparents at home, the camera captures smooth video and crisp digital audio that makes you feel like you're right there with them.",http://www.belkin.com/us/F7D7602-Belkin/p/P-F7D7602/,http://iotlist.co/posts/netcam-hd-wi-fi-camera-with-night-vision,http://www.belkin.com/us/F7D7602-Belkin/p/P-F7D7602/
http://iotlist.co/?page=25,NetCam: HD Wi-Fi camera with night vision,http://iotlist.co/posts/netcam-hd-wi-fi-camera-with-night-vision,http://iotlist-production.s3-us-west-2.amazonaws.com/uploads/production/post_attachment/492/file/belkin-bk-F7D7602-1.jpg,"NetCam HD allow you to keep tabs on kids or pets from your smartphone or tablet--it also allows you to see all the action in vibrant 720p HD video. Ideal for anyone who has kids, pets, or grandparents at home, the camera captures smooth video and crisp digital audio that makes you feel like you're right there with them.",http://www.belkin.com/us/F7D7602-Belkin/p/P-F7D7602/,http://iotlist.co/posts/netcam-hd-wi-fi-camera-with-night-vision,http://www.belkin.com/us/F7D7602-Belkin/p/P-F7D7602/
http://iotlist.co/?page=27,Neuma: Measure and manage the autonomic brain,http://iotlist.co/posts/neuma-measure-and-manage-the-autonomic-brain,http://iotlist-production.s3-us-west-2.amazonaws.com/uploads/production/post_attachment/417/file/images.jpeg,Neuma is a biosensing watch that helps measure and manage the autonomic nervous system in a design that blends into daily life demands.,https://neumitra.com/order/,http://iotlist.co/posts/neuma-measure-and-manage-the-autonomic-brain,https://neumitra.com/
