url,Title link,Title link_link,Mediainner image,Description,Buy link_link,Video link_link,Website link_link
http://iotlist.co/?page=35,94fifty: The first smart sensor basketball,http://iotlist.co/posts/94fifty-the-first-smart-sensor-basketball,http://iotlist-production.s3-us-west-2.amazonaws.com/uploads/production/post_attachment/175/file/home-ball-triple.png,"94Fifty delivers information and feedback in the way that players want it. Fast, engaging, challenging, and always unbiased and accurate.",http://shop.94fifty.com/collections/products,http://iotlist.co/posts/94fifty-the-first-smart-sensor-basketball,http://shop.94fifty.com/
http://iotlist.co/?page=19,Adidas MiCOACH SMART BALL,http://iotlist.co/posts/adidas-micoach-smart-ball,http://iotlist-production.s3-us-west-2.amazonaws.com/uploads/production/post_attachment/608/file/G83963_01.jpeg,"Integrated sensor inside the ball detects speed, spin, strike and flight path data and instantly relays kick data to the miCoach app on your Apple device running iOS 7 or higher via Bluetooth 4.0",http://www.adidas.com/us/product/training-mi-coach-smart-soccer-ball/AK429?cid=G83963&breadcrumb=1z13071Z1z11zrfZ1z11vmg,http://iotlist.co/posts/adidas-micoach-smart-ball,http://micoach.adidas.com/us/smartball
http://iotlist.co/?page=20,Adidas MiCOACH SMART BALL,http://iotlist.co/posts/adidas-micoach-smart-ball,http://iotlist-production.s3-us-west-2.amazonaws.com/uploads/production/post_attachment/608/file/G83963_01.jpeg,"Integrated sensor inside the ball detects speed, spin, strike and flight path data and instantly relays kick data to the miCoach app on your Apple device running iOS 7 or higher via Bluetooth 4.0",http://www.adidas.com/us/product/training-mi-coach-smart-soccer-ball/AK429?cid=G83963&breadcrumb=1z13071Z1z11zrfZ1z11vmg,http://iotlist.co/posts/adidas-micoach-smart-ball,http://micoach.adidas.com/us/smartball
http://iotlist.co/?page=7,Aether Cone: The thinking music player,http://iotlist.co/posts/aether-cone-the-thinking-music-player,http://iotlist-production.s3-us-west-2.amazonaws.com/uploads/production/post_attachment/998/file/download.jpeg,Music is a great use case for the smart home. Sonos has been the leader but there are new options coming on the market daily. Aether Cone is a very cool product with amazing design. The speaker learns what and where you listen music and learns what based to recommend based on the data. This is the key feature of Aether Cone. This is a great product for someone who is in a small space and loves the Rdio service (Aether currently only works with Rdio). It will be interesting to see how the connected music space plays out in the next few years. Will the bluetooth speakers become more connected systems or will the wifi speakers become more portable.,http://www.amazon.com/gp/product/B00MCVPIJI/ref=as_li_qf_sp_asin_il_tl?ie=UTF8&camp=1789&creative=9325&creativeASIN=B00MCVPIJI&linkCode=as2&tag=iotlist-20&linkId=K5H2GFOGK2WI2TXF,http://iotlist.co/posts/aether-cone-the-thinking-music-player,http://www.aether.com/
http://iotlist.co/?page=18,Airfy: iBeacon for home automation,http://iotlist.co/posts/airfy-ibeacon-for-home-automation,http://iotlist-production.s3-us-west-2.amazonaws.com/uploads/production/post_attachment/672/file/photo-main.jpg,Airfy beacon allows you to make your home smart using one or more ‰ÛÏbeacons‰Ûù - tiny receivers that connect to your phone through Bluetooth Low Energy (iBeacon).,https://www.kickstarter.com/projects/261147844/airfy-beacon-imagination-meets-smart-home-automati,http://iotlist.co/posts/airfy-ibeacon-for-home-automation,http://www.airfy.com/
http://iotlist.co/?page=31,Alima: Smart indoor air quality monitor,http://iotlist.co/posts/alima-smart-indoor-air-quality-monitor,http://iotlist-production.s3-us-west-2.amazonaws.com/uploads/production/post_attachment/322/file/crop-abl_11.png,"Alima is the first smart device to monitor indoor air quality, sending you messages about pollution levels and predictions of upcoming events. By learning our indoor environment and habits, alima helps to change the behaviors that contribute to pollution.",http://getalima.com/,http://iotlist.co/posts/alima-smart-indoor-air-quality-monitor,http://getalima.com/
http://iotlist.co/?page=38,AliveCor: Heart Monitor,http://iotlist.co/posts/alivecor-heart-monitor,http://iotlist-production.s3-us-west-2.amazonaws.com/uploads/production/post_attachment/140/file/heartmonitor_front_4_4S-500x500.jpg,"Introducing the AliveCor Mobile Heart Monitor. The AliveCor Heart Monitor is available to medical professionals and patients in the U.S., U.K. and Ireland and health conscious individuals in the U.K. and Ireland to record, display, store, and transfer single-channel electrocardiogram (ECG) rhythms.",http://store.alivecor.com/,http://iotlist.co/posts/alivecor-heart-monitor,http://www.alivecor.com/home
http://iotlist.co/?page=6,Allure EverSense: Proximity based thermostat,http://iotlist.co/posts/allure-eversense-proximity-based-thermostat,http://iotlist-production.s3-us-west-2.amazonaws.com/uploads/production/post_attachment/957/file/3a849e67-dbae-4958-989c-d752fc4bccfe_400.jpg,"We believe there will be three new controls that will be introduce into the home over the next few months. Voice, wearables and presence will change the way we all interact with our home in the near future. Allure EverSense attempts to leverage presence as a way to personalize your thermostat based on the location of your smartphone. The most interesting feature of EverSense is that it supports music play back. It is a very cool feature which extends the functionality of your thermostat. EverSense is more like a home control system with a thermostat attached.",http://amzn.to/1FcFaUQ,http://iotlist.co/posts/allure-eversense-proximity-based-thermostat,https://www.allure-energy.com/mainpage.html
http://iotlist.co/?page=24,ALYT: SmartHome hub,http://iotlist.co/posts/alyt-smarthome-hub,http://iotlist-production.s3-us-west-2.amazonaws.com/uploads/production/post_attachment/501/file/02.jpg,"ALYT is a first and revolutionary Android based Smart Home Manager that combines professional security, energy management, together with multiple applications and devices to bring Internet of Things (IoT) to a reality and into our homes.",https://www.indiegogo.com/projects/alyt-security-smarthome-android-powered-for-apple-and-android-devices,http://iotlist.co/posts/alyt-smarthome-hub,http://www.alyt.com/
http://iotlist.co/?page=25,ALYT: SmartHome hub,http://iotlist.co/posts/alyt-smarthome-hub,http://iotlist-production.s3-us-west-2.amazonaws.com/uploads/production/post_attachment/501/file/02.jpg,"ALYT is a first and revolutionary Android based Smart Home Manager that combines professional security, energy management, together with multiple applications and devices to bring Internet of Things (IoT) to a reality and into our homes.",https://www.indiegogo.com/projects/alyt-security-smarthome-android-powered-for-apple-and-android-devices,http://iotlist.co/posts/alyt-smarthome-hub,http://www.alyt.com/
http://iotlist.co/?page=4,Amazon Dash Button: Smart home shopping,http://iotlist.co/posts/amazon-dash-button-smart-home-shopping,http://iotlist-production.s3-us-west-2.amazonaws.com/uploads/production/post_attachment/985/file/61up4U2txRL._SL1000_.jpg,Amazon has been to great job of moving into the smart home over the past year. The Dash Button is not exception. A consumer can place a button anywhere in the home/business and simply push the button when the product needs to be refilled. This is a great smart home product and will help consumers understand the value of starting to connect there home.,http://amzn.to/1SVSDlN,http://iotlist.co/posts/amazon-dash-button-smart-home-shopping,http://www.amazon.com/b/?node=10667898011&lo=digital-text
http://iotlist.co/?page=4,Amazon Echo: Voice controller for your home,http://iotlist.co/posts/amazon-echo-voice-controller-for-your-home,http://iotlist-production.s3-us-west-2.amazonaws.com/uploads/production/post_attachment/981/file/51XeN2UYoyL._SL1000_.jpg,"Amazon had a limited released the Echo device a few months back and the reviews were great. We received our Echo and have been testing it for the last 3 weeks. In short...it is amazing! This is the best voice interface we have tested bar none. You can play music, turn on your lights and order from Amazon all using your voice. Amazon continues to update Echo with new integrations which means the device will only get better.",http://amzn.to/1NwkdVL,http://iotlist.co/posts/amazon-echo-voice-controller-for-your-home,http://amzn.to/1NwkdVL
http://iotlist.co/?page=18,Amazon Fire TV: Streaming media device,http://iotlist.co/posts/amazon-fire-tv-streaming-media-device,http://iotlist-production.s3-us-west-2.amazonaws.com/uploads/production/post_attachment/666/file/amazon_firetv.png,"Amazon Fire TV is a tiny box that connects your HDTV to a world of online entertainment. It's the easiest way to enjoy Netflix, Prime Instant Video, Hulu Plus, low-cost instant video rentals, games, photos, and more.",http://www.amazon.com/gp/product/B00CX5P8FC/ref=as_li_qf_sp_asin_il_tl?ie=UTF8&camp=1789&creative=9325&creativeASIN=B00CX5P8FC&linkCode=as2&tag=thegadgetflow-20,http://iotlist.co/posts/amazon-fire-tv-streaming-media-device,http://www.amazon.com/Streaming-Internet-Media-Player/oc/Fire-TV
http://iotlist.co/,Amazon Tap: Portable voice controlled speaker,http://iotlist.co/posts/amazon-tap-portable-voice-controlled-speaker,http://iotlist-production.s3-us-west-2.amazonaws.com/uploads/production/post_attachment/1031/file/61uaiTkIRSL._SL1000_.jpg,"Building on the success of Echo, Amazon has just released the Tap which is a portable bluetooth speaker with voice control. We are starting to see Amazon plan for the home continue to roll out. Excited to test the device when it arrives.",http://amzn.to/21GOY5a,http://iotlist.co/posts/amazon-tap-portable-voice-controlled-speaker,http://amzn.to/21GOY5a
http://iotlist.co/?page=13,Ambi Climate: Smart add-on for your air conditioner,http://iotlist.co/posts/ambi-climate-smart-add-on-for-your-air-conditioner,http://iotlist-production.s3-us-west-2.amazonaws.com/uploads/production/post_attachment/816/file/cover_photo.png,"Ambi Climate is a small, sleek internet of things device that makes your existing infrared remote-controlled air conditioner smart. It allows you to sync your AC with your smartphone, giving you complete access to monitor and control your air conditioner wherever you are.",https://www.kickstarter.com/projects/ambi-labs/ambi-climate-the-smart-add-on-for-your-air-conditi,http://iotlist.co/posts/ambi-climate-smart-add-on-for-your-air-conditioner,http://www.ambiclimate.com/
http://iotlist.co/?page=37,Amiigo: Fitness Bracelet for iPhone and Android,http://iotlist.co/posts/amiigo-fitness-bracelet-for-iphone-and-android,http://iotlist-production.s3-us-west-2.amazonaws.com/uploads/production/post_attachment/202/file/bracelet3.png,"The Amiigo Bracelet measures and tracks specific exercises, reps, sets, heart rate, calories burned. See your details immediately on your iPhone or Android.",http://www.indiegogo.com/projects/amiigo-fitness-bracelet-for-iphone-and-android,http://iotlist.co/posts/amiigo-fitness-bracelet-for-iphone-and-android,http://amiigo.co/
http://iotlist.co/?page=38,Angel: The first open sensor for health and fitness,http://iotlist.co/posts/angel-the-first-open-sensor-for-health-and-fitness,http://iotlist-production.s3-us-west-2.amazonaws.com/uploads/production/post_attachment/149/file/20130915072350-10_colors.jpg,"Everyone wants to live better, healthier lives. Angel was designed to make this possible. It's a wristband that monitors pulse, temperature, activity and blood oxygen level. Angel can send this vital information to apps on your smartphone, laptop and pretty soon even your treadmill.",http://www.angelsensor.com/,http://iotlist.co/posts/angel-the-first-open-sensor-for-health-and-fitness,http://www.angelsensor.com/
http://iotlist.co/?page=39,Angel: The first open sensor for health and fitness,http://iotlist.co/posts/angel-the-first-open-sensor-for-health-and-fitness,http://iotlist-production.s3-us-west-2.amazonaws.com/uploads/production/post_attachment/149/file/20130915072350-10_colors.jpg,"Everyone wants to live better, healthier lives. Angel was designed to make this possible. It's a wristband that monitors pulse, temperature, activity and blood oxygen level. Angel can send this vital information to apps on your smartphone, laptop and pretty soon even your treadmill.",http://www.angelsensor.com/,http://iotlist.co/posts/angel-the-first-open-sensor-for-health-and-fitness,http://www.angelsensor.com/
http://iotlist.co/?page=3,Apple TV: Apps and voice control,http://iotlist.co/posts/apple-tv-apps-and-voice-control,http://iotlist-production.s3-us-west-2.amazonaws.com/uploads/production/post_attachment/1012/file/apple-tv-hero-select-201510.jpeg,Apple has released the latest version of Apple TV. Our team has been huge fans of Apple TV since it launched. The latest version brings the long anticipated arrival of a true app store for connected TVs and voice control via Siri. This should have a huge impact on what it means to have a connected screen in your home. Content and gaming are the low hanging fruit for the app store but we are excited to see the ideas that leverage the large screen in ways we would never have never imagined. For instance...is there a better experience for video meetings when you can leverage the connected screen?,http://www.apple.com/shop/buy-tv/apple-tv,http://iotlist.co/posts/apple-tv-apps-and-voice-control,http://www.apple.com/tv/
http://iotlist.co/?page=2,Apple Watch: Smart watch with style,http://iotlist.co/posts/apple-watch-smart-watch-with-style,http://iotlist-production.s3-us-west-2.amazonaws.com/uploads/production/post_attachment/1015/file/w38ss-ml-gallery-4.jpeg,"We have been wearing the Apple Watch since launch and now have a great understanding of the value it brings. First, it is a great fashion accessory. Second, it is the coolest looking activity tracker on the market. Third, it works best when you use all of Apple apps such as mail, calendar, maps, etc. It is a very cool device and will continue to get better.",http://www.apple.com/watch/buy/,http://iotlist.co/posts/apple-watch-smart-watch-with-style,http://www.apple.com/watch/
http://iotlist.co/,Apple Watch: Smart watch with style,http://iotlist.co/posts/apple-watch-smart-watch-with-style,http://iotlist-production.s3-us-west-2.amazonaws.com/uploads/production/post_attachment/1015/file/w38ss-ml-gallery-4.jpeg,"We have been wearing the Apple Watch since launch and now have a great understanding of the value it brings. First, it is a great fashion accessory. Second, it is the coolest looking activity tracker on the market. Third, it works best when you use all of Apple apps such as mail, calendar, maps, etc. It is a very cool device and will continue to get better.",http://www.apple.com/watch/buy/,http://iotlist.co/posts/apple-watch-smart-watch-with-style,http://www.apple.com/watch/
http://iotlist.co/?page=19,Archos: Smart home starter pack,http://iotlist.co/posts/archos-smart-home-starter-pack,http://iotlist-production.s3-us-west-2.amazonaws.com/uploads/production/post_attachment/627/file/ash.jpg,"Connecting your home with ease with the Starter Pack. It includes the Smart Home Tablet, 2 Mini Cam, 2 Weather Tag & 2 Movement Tag.",http://www.archos.com/pt/store/index.html?pn=502660&fam_id=connected_home,http://iotlist.co/posts/archos-smart-home-starter-pack,http://www.archos.com/us/products/objects/chome/ash/index.html
http://iotlist.co/?page=20,Archos: Smart home starter pack,http://iotlist.co/posts/archos-smart-home-starter-pack,http://iotlist-production.s3-us-west-2.amazonaws.com/uploads/production/post_attachment/627/file/ash.jpg,"Connecting your home with ease with the Starter Pack. It includes the Smart Home Tablet, 2 Mini Cam, 2 Weather Tag & 2 Movement Tag.",http://www.archos.com/pt/store/index.html?pn=502660&fam_id=connected_home,http://iotlist.co/posts/archos-smart-home-starter-pack,http://www.archos.com/us/products/objects/chome/ash/index.html
http://iotlist.co/?page=10,Arlo: Smart home security camera system,http://iotlist.co/posts/arlo-smart-home-security-camera-system,http://iotlist-production.s3-us-west-2.amazonaws.com/uploads/production/post_attachment/896/file/71uXIySQGML._SL1500_.jpg,The world's first and only 100% wire-free HD weatherproof security camera. No cords. No wires. No worries.,http://amzn.to/1CIy9J3,http://iotlist.co/posts/arlo-smart-home-security-camera-system,http://www.arlo.com/
http://iotlist.co/?page=19,Aros: Smart window air conditioner,http://iotlist.co/posts/aros-smart-window-air-conditioner,http://iotlist-production.s3-us-west-2.amazonaws.com/uploads/production/post_attachment/632/file/7_-_aros_phone.jpg,"Ditch your dumb window A/C for Aros, because Aros is smart. It learns from your budget, location, schedule, and usage to automatically maintain the perfect temperature and maximize savings for your home. What's more, it can be controlled from anywhere using the Wink app on your mobile device.",http://www.quirky.com/shop/752,http://iotlist.co/posts/aros-smart-window-air-conditioner,http://www.quirky.com/shop/752
http://iotlist.co/?page=36,Athos: Rethink the way you measure fitness,http://iotlist.co/posts/athos-rethink-the-way-you-measure-fitness,http://iotlist-production.s3-us-west-2.amazonaws.com/uploads/production/post_attachment/169/file/athos-core-thepush.png,"When you exercise with Athos, you'll get a wealth of personalized data to help you get an edge on the competition.",https://www.liveathos.com/,http://iotlist.co/posts/athos-rethink-the-way-you-measure-fitness,https://www.liveathos.com/
http://iotlist.co/?page=20,Atlas: Fitness tracker,http://iotlist.co/posts/atlas-fitness-tracker,http://iotlist-production.s3-us-west-2.amazonaws.com/uploads/production/post_attachment/606/file/slide-3-h-wristband.png,"Atlas is a fitness tracker that identifies your exercises, counts your reps and sets, calculates the calories you burned and evaluates your form. Atlas measures your success; all you have to do is work out.",http://atlaswearables.com/,http://iotlist.co/posts/atlas-fitness-tracker,http://atlaswearables.com/
http://iotlist.co/?page=21,Atlas: Fitness tracker,http://iotlist.co/posts/atlas-fitness-tracker,http://iotlist-production.s3-us-west-2.amazonaws.com/uploads/production/post_attachment/606/file/slide-3-h-wristband.png,"Atlas is a fitness tracker that identifies your exercises, counts your reps and sets, calculates the calories you burned and evaluates your form. Atlas measures your success; all you have to do is work out.",http://atlaswearables.com/,http://iotlist.co/posts/atlas-fitness-tracker,http://atlaswearables.com/
http://iotlist.co/?page=3,August: Doorbell cam,http://iotlist.co/posts/august-doorbell-cam,http://iotlist-production.s3-us-west-2.amazonaws.com/uploads/production/post_attachment/997/file/Doorbell-Cam-desktop_05.jpg,"August just released it's doorbell cam which detects motion from visitors, identifies people at your door and sends you an instant alert to your smartphone. This would be a great addition to anyone's home who is looking for a good way to tested out smart home products. We hope to get our doorbell cam to test soon.",http://amzn.to/1lxKj1E,http://iotlist.co/posts/august-doorbell-cam,http://august.com/products/august-doorbell/
http://iotlist.co/?page=2,August: Smart Keypad,http://iotlist.co/posts/august-smart-keypad,http://iotlist-production.s3-us-west-2.amazonaws.com/uploads/production/post_attachment/1023/file/71o994XKulL._SL1500_.jpg,"August continues to redefine access to the home. Their latest product is a smart keypad that works with the August lock. This is a great addition to the product line up as it makes the smart lock useable by everyone in the family without forcing them to have a smartphone and the August app. Combine the lock, doorbell cam and smart keypad and you have yourself one awesome door: )",http://amzn.to/1QuUtNz,http://iotlist.co/posts/august-smart-keypad,http://august.com/products/august-keypad/
http://iotlist.co/,August: Smart Keypad,http://iotlist.co/posts/august-smart-keypad,http://iotlist-production.s3-us-west-2.amazonaws.com/uploads/production/post_attachment/1023/file/71o994XKulL._SL1500_.jpg,"August continues to redefine access to the home. Their latest product is a smart keypad that works with the August lock. This is a great addition to the product line up as it makes the smart lock useable by everyone in the family without forcing them to have a smartphone and the August app. Combine the lock, doorbell cam and smart keypad and you have yourself one awesome door: )",http://amzn.to/1QuUtNz,http://iotlist.co/posts/august-smart-keypad,http://august.com/products/august-keypad/
http://iotlist.co/?page=6,August: Smart lock,http://iotlist.co/posts/august-smart-lock,http://iotlist-production.s3-us-west-2.amazonaws.com/uploads/production/post_attachment/955/file/august-AUG-SL01-M01-C03.png,August Smart Lock has been mentioned as the next great smart home product. With installation taking under 10 mins it is easy to anyone to setup. If you are looking for a easy way to control access to your home it is a great solution. We have been testing the lock for the past month and it works pretty well. One of the best features is Everlock which automatically locks your door anytime you leave based on your phones geo location. We find this to be a great experience for those who are always running late to meetings and forget to lock the door :),http://amzn.to/1yG12jW,http://iotlist.co/posts/august-smart-lock,http://www.august.com/
http://iotlist.co/?page=15,Aura: Enrich your sleep experience,http://iotlist.co/posts/aura-enrich-your-sleep-experience,http://iotlist-production.s3-us-west-2.amazonaws.com/uploads/production/post_attachment/757/file/sdf.jpg,"Withings Aura is a well thought-out active system designed to both monitor and improve sleep quality. Our technology combines a contact-free Sleep Sensor tucked under the mattress, an active light & sound Bedside Device, and a smartphone app.",http://www.withings.com/us/store.html,http://iotlist.co/posts/aura-enrich-your-sleep-experience,http://www.withings.com/us/withings-aura.html
http://iotlist.co/?page=34,"Autographer: The world‰Ûªs first intelligent, wearable camera",http://iotlist.co/posts/autographer-the-world-s-first-intelligent-wearable-camera,http://iotlist-production.s3-us-west-2.amazonaws.com/uploads/production/post_attachment/228/file/dezeen_Autographer-by-OMG-Life-and-Chauhan-Studio_11a.jpg,"Autographer is a new type of camera which has been custom built to enable spontaneous, hands-free image capture",http://store.autographer.com/,http://iotlist.co/posts/autographer-the-world-s-first-intelligent-wearable-camera,http://www.autographer.com/
http://iotlist.co/?page=36,Automatic: Your smart driving assistant,http://iotlist.co/posts/automatic-your-smart-driving-assistant,http://iotlist-production.s3-us-west-2.amazonaws.com/uploads/production/post_attachment/166/file/HD778_AV1.jpeg,"Just plug the Automatic Link into your car's data port. Your car and smartphone will automatically connect whenever you drive, wirelessly.",https://www.automatic.com/order/,http://iotlist.co/posts/automatic-your-smart-driving-assistant,http://www.automatic.com/
http://iotlist.co/?page=4,Awair: Smart air quality monitor,http://iotlist.co/posts/awair-smart-air-quality-monitor,http://iotlist-production.s3-us-west-2.amazonaws.com/uploads/production/post_attachment/984/file/81yLxEoR4mL._SL1500_.jpg,"The Awair Smart Air Quality Monitor uses sensors to keep track of the air around you, including the temperature, humidity, carbon dioxide, toxic chemicals, and dust. Awair learns your lifestyle routines and preferences to provide more relevant and personalized tips to help you take control of your environment.",http://amzn.to/1LRsgx4,http://iotlist.co/posts/awair-smart-air-quality-monitor,https://getawair.com/
http://iotlist.co/?page=24,AwoX: Bluetooth Music Light,http://iotlist.co/posts/awox-bluetooth-music-light,http://iotlist-production.s3-us-west-2.amazonaws.com/uploads/production/post_attachment/504/file/51qZe8qVtZL._SL1500_.jpg,AwoX StriimLIGHT is an energy-saving LED light bulb with an integrated Bluetoothå¨ speaker.,http://www.amazon.com/AwoX-StriimLIGHT-SL-B10-Bluetooth-Music/dp/B00HMF6K5A/ref=sr_1_fkmr1_1?ie=UTF8&qid=1395262349&sr=8-1-fkmr1&keywords=StriimLIGHT+Wi-Fi,http://iotlist.co/posts/awox-bluetooth-music-light,http://www.awox.com/connected-lighting/awox-striim-light/
http://iotlist.co/?page=25,AwoX: Bluetooth Music Light,http://iotlist.co/posts/awox-bluetooth-music-light,http://iotlist-production.s3-us-west-2.amazonaws.com/uploads/production/post_attachment/504/file/51qZe8qVtZL._SL1500_.jpg,AwoX StriimLIGHT is an energy-saving LED light bulb with an integrated Bluetoothå¨ speaker.,http://www.amazon.com/AwoX-StriimLIGHT-SL-B10-Bluetooth-Music/dp/B00HMF6K5A/ref=sr_1_fkmr1_1?ie=UTF8&qid=1395262349&sr=8-1-fkmr1&keywords=StriimLIGHT+Wi-Fi,http://iotlist.co/posts/awox-bluetooth-music-light,http://www.awox.com/connected-lighting/awox-striim-light/
http://iotlist.co/,AWS IoT Button: Programmable dash button,http://iotlist.co/posts/aws-iot-button-programmable-dash-button,http://iotlist-production.s3-us-west-2.amazonaws.com/uploads/production/post_attachment/1037/file/51Jq0GnSKWL._SL1000_.jpg,The AWS IoT button is a great device for the hacker in all of us. Our team has thousands of ideas on how we plan to use the button. From automating Postmates orders to starting our car.,https://youtu.be/rb7S0_T2kvM,http://iotlist.co/posts/aws-iot-button-programmable-dash-button,http://amzn.to/1XecOmh
