url,Title link,Title link_link,Mediainner image,Description,Buy link_link,Video link_link,Website link_link
http://iotlist.co/?page=21,Glance: World's first smart accessory for your watch,http://iotlist.co/posts/glance-world-s-first-smart-accessory-for-your-watch,http://iotlist-production.s3-us-west-2.amazonaws.com/uploads/production/post_attachment/601/file/1202d577ebbaa826e27eacc4e9b072e2_large.png,"Glance is a smart accessory that tells you who is calling, helps you find your phone, enables motion control and activity tracking.",https://www.kickstarter.com/projects/1742184757/glance-worlds-first-smart-accessory-for-your-watch,http://iotlist.co/posts/glance-world-s-first-smart-accessory-for-your-watch,http://www.kiwiwearables.com/
http://iotlist.co/?page=38,GLASS: Connected glasses from Google,http://iotlist.co/posts/glass-connected-glasses-from-google,http://iotlist-production.s3-us-west-2.amazonaws.com/uploads/production/post_attachment/347/file/google-glass.png,"Project Glass is technology that‰Ûªs seamless, beautiful and empowering. To share the world through your eyes.",http://www.google.com/glass/start/how-to-get-one/,http://iotlist.co/posts/glass-connected-glasses-from-google,http://www.google.com/glass/start/
http://iotlist.co/?page=39,GLASS: Connected glasses from Google,http://iotlist.co/posts/glass-connected-glasses-from-google,http://iotlist-production.s3-us-west-2.amazonaws.com/uploads/production/post_attachment/347/file/google-glass.png,"Project Glass is technology that‰Ûªs seamless, beautiful and empowering. To share the world through your eyes.",http://www.google.com/glass/start/how-to-get-one/,http://iotlist.co/posts/glass-connected-glasses-from-google,http://www.google.com/glass/start/
http://iotlist.co/?page=15,Glyph: Personal theater with premium audio,http://iotlist.co/posts/glyph-personal-theater-with-premium-audio,http://iotlist-production.s3-us-west-2.amazonaws.com/uploads/production/post_attachment/733/file/color_grey.png,"Experience stark, vivid images like nothing you've ever seen combined with premium audio in a unique flip down form factor.",http://avegant.com/pre-order/,http://iotlist.co/posts/glyph-personal-theater-with-premium-audio,http://avegant.com/
http://iotlist.co/?page=23,Goccia: The world's smallest activity tracker,http://iotlist.co/posts/goccia-the-world-s-smallest-activity-tracker,http://iotlist-production.s3-us-west-2.amazonaws.com/uploads/production/post_attachment/509/file/image1.png,"An elegantly designed, 100% waterproof, smart activity tracker using new LED light syncing technology. The world's smallest and simplest activity tracker blends elegance, precise craftsmanship, simplicity and nature in one design.",https://www.kickstarter.com/projects/1269010520/goccia-the-worlds-smallest-and-simplest-activity-t,http://iotlist.co/posts/goccia-the-world-s-smallest-activity-tracker,http://www.g-wearables.com/
http://iotlist.co/?page=24,Goccia: The world's smallest activity tracker,http://iotlist.co/posts/goccia-the-world-s-smallest-activity-tracker,http://iotlist-production.s3-us-west-2.amazonaws.com/uploads/production/post_attachment/509/file/image1.png,"An elegantly designed, 100% waterproof, smart activity tracker using new LED light syncing technology. The world's smallest and simplest activity tracker blends elegance, precise craftsmanship, simplicity and nature in one design.",https://www.kickstarter.com/projects/1269010520/goccia-the-worlds-smallest-and-simplest-activity-t,http://iotlist.co/posts/goccia-the-world-s-smallest-activity-tracker,http://www.g-wearables.com/
http://iotlist.co/?page=28,Goji Play: Turn your cardio workout into a interactive game,http://iotlist.co/posts/goji-play-turn-your-cardio-workout-into-a-interactive-game,http://iotlist-production.s3-us-west-2.amazonaws.com/uploads/production/post_attachment/375/file/download.jpeg,"Transform any cardio equipment into an interactive game machine. Attach the wireless controllers to cardio equipment, clip on the activity sensor, and you‰Ûªre ready to play a variety of games, all while tracking your fitness metrics.",http://goji-play.myshopify.com/cart,http://iotlist.co/posts/goji-play-turn-your-cardio-workout-into-a-interactive-game,http://bluegoji.com/
http://iotlist.co/?page=29,Goji Play: Turn your cardio workout into a interactive game,http://iotlist.co/posts/goji-play-turn-your-cardio-workout-into-a-interactive-game,http://iotlist-production.s3-us-west-2.amazonaws.com/uploads/production/post_attachment/375/file/download.jpeg,"Transform any cardio equipment into an interactive game machine. Attach the wireless controllers to cardio equipment, clip on the activity sensor, and you‰Ûªre ready to play a variety of games, all while tracking your fitness metrics.",http://goji-play.myshopify.com/cart,http://iotlist.co/posts/goji-play-turn-your-cardio-workout-into-a-interactive-game,http://bluegoji.com/
http://iotlist.co/?page=35,Goji: Smart lock,http://iotlist.co/posts/goji-smart-lock,http://iotlist-production.s3-us-west-2.amazonaws.com/uploads/production/post_attachment/353/file/Goji_Lock_1024x1024.jpg,"Goji takes pictures of who is at your door and automatically sends you picture alerts to your mobile phone, providing you with real-time information about who is accessing your home.",http://www.gojiaccess.com/shop-goji.html,http://iotlist.co/posts/goji-smart-lock,http://www.gojiaccess.com/
http://iotlist.co/?page=36,Goldee: Smart light controller,http://iotlist.co/posts/goldee-smart-light-controller,http://iotlist-production.s3-us-west-2.amazonaws.com/uploads/production/post_attachment/239/file/Light_Scene_White-580x493.jpg,Intelligent light that caters to you.,https://getgoldee.com/preorder,http://iotlist.co/posts/goldee-smart-light-controller,http://getgoldee.com/
http://iotlist.co/?page=40,Good Night Lamp: Connected home experience,http://iotlist.co/posts/good-night-lamp-connected-home-experience,http://iotlist-production.s3-us-west-2.amazonaws.com/uploads/production/post_attachment/1008/file/Pair-ortho-elevation-shadow.jpg,The Good Night Lamp is a family of connected lamps that lets you share your presence & availability to your loved ones easily and in an ambient way.,https://gnlamp.myshopify.com/,http://iotlist.co/posts/good-night-lamp-connected-home-experience,http://goodnightlamp.com/
http://iotlist.co/?page=3,Google Chromecast: Second generation,http://iotlist.co/posts/google-chromecast-second-generation,http://iotlist-production.s3-us-west-2.amazonaws.com/uploads/production/post_attachment/999/file/what-is-chromecast.jpg,Chromecast has always been the easiest and most cost efficient way to make any TV smart and cast your favorite videos to the big screen. The new Chromecast delivers on that promise and brings support to a few new apps like Sling TV.,https://store.google.com/product/chromecast_2015,http://iotlist.co/posts/google-chromecast-second-generation,https://store.google.com/product/chromecast_2015
http://iotlist.co/?page=38,Greenbox: A smartphone-controlled watering system for your yard,http://iotlist.co/posts/greenbox-a-smartphone-controlled-watering-system-for-your-yard,http://iotlist-production.s3-us-west-2.amazonaws.com/uploads/production/post_attachment/1010/file/51gQ8EuqXoL._SL1100_.jpg,"The Greenbox irrigation controller optimizes garden watering based on local weather, your own preferences, and regional restrictions. Access it from anywhere over WiFi.",http://amzn.to/1NqHFUM,http://iotlist.co/posts/greenbox-a-smartphone-controlled-watering-system-for-your-yard,http://www.greenboxhq.com/#
http://iotlist.co/?page=39,Greenbox: A smartphone-controlled watering system for your yard,http://iotlist.co/posts/greenbox-a-smartphone-controlled-watering-system-for-your-yard,http://iotlist-production.s3-us-west-2.amazonaws.com/uploads/production/post_attachment/1010/file/51gQ8EuqXoL._SL1100_.jpg,"The Greenbox irrigation controller optimizes garden watering based on local weather, your own preferences, and regional restrictions. Access it from anywhere over WiFi.",http://amzn.to/1NqHFUM,http://iotlist.co/posts/greenbox-a-smartphone-controlled-watering-system-for-your-yard,http://www.greenboxhq.com/#
http://iotlist.co/?page=34,Haloband: Control your smartphone with simple wrist move,http://iotlist.co/posts/haloband-control-your-smartphone-with-simple-wrist-move,http://iotlist-production.s3-us-west-2.amazonaws.com/uploads/production/post_attachment/216/file/all1300718.png,Haloband is a wearable device you can customize. Get your NFC smartphone common actions from just tapping. Let's make smart easy.,http://www.haloband.me/,http://iotlist.co/posts/haloband-control-your-smartphone-with-simple-wrist-move,http://www.haloband.me/
http://iotlist.co/?page=26,Hammerhead One: Navigation for bike riders,http://iotlist.co/posts/hammerhead-one-navigation-for-bike-riders,http://iotlist-production.s3-us-west-2.amazonaws.com/uploads/production/post_attachment/441/file/26955185_max.jpg,A handlebar mounted device that navigates riders and help find cool bike routes in the neighborhood.,http://www.hammerhead.io/,http://iotlist.co/posts/hammerhead-one-navigation-for-bike-riders,http://www.hammerhead.io/
http://iotlist.co/?page=27,Hammerhead One: Navigation for bike riders,http://iotlist.co/posts/hammerhead-one-navigation-for-bike-riders,http://iotlist-production.s3-us-west-2.amazonaws.com/uploads/production/post_attachment/441/file/26955185_max.jpg,A handlebar mounted device that navigates riders and help find cool bike routes in the neighborhood.,http://www.hammerhead.io/,http://iotlist.co/posts/hammerhead-one-navigation-for-bike-riders,http://www.hammerhead.io/
http://iotlist.co/?page=38,HarvestGeek: Brains For Your Garden,http://iotlist.co/posts/harvestgeek-brains-for-your-garden,http://iotlist-production.s3-us-west-2.amazonaws.com/uploads/production/post_attachment/116/file/One_mikeedit-690156b494d75c7537b6e2c04e7636fa.png,"HarvestBots are small electronic devices equipped with sensors that when deployed in your garden monitors the vitals, communicates the information back to the cloud and allows you to automate equipment based on real-time data.",http://www.kickstarter.com/projects/2077260917/harvestgeek-brains-for-your-garden,http://iotlist.co/posts/harvestgeek-brains-for-your-garden,http://www.harvestgeek.com/
http://iotlist.co/?page=24,Healbe GoBe: Automatically measure calorie intake,http://iotlist.co/posts/healbe-gobe-automatically-measure-calorie-intake,http://iotlist-production.s3-us-west-2.amazonaws.com/uploads/production/post_attachment/490/file/goBe-device2.png,"GoBe is the only way to automatically measure calorie intake‰ÛÓthrough your skin, by reading the glucose in your cells. Simply wear it to see calories consumed and burned, activity, hydration, sleep, stress levels, and more, delivered effortlessly to your smartphone.",https://www.indiegogo.com/projects/healbe-gobe-the-only-way-to-automatically-measure-calorie-intake,http://iotlist.co/posts/healbe-gobe-automatically-measure-calorie-intake,http://healbe.com/
http://iotlist.co/?page=25,Healbe GoBe: Automatically measure calorie intake,http://iotlist.co/posts/healbe-gobe-automatically-measure-calorie-intake,http://iotlist-production.s3-us-west-2.amazonaws.com/uploads/production/post_attachment/490/file/goBe-device2.png,"GoBe is the only way to automatically measure calorie intake‰ÛÓthrough your skin, by reading the glucose in your cells. Simply wear it to see calories consumed and burned, activity, hydration, sleep, stress levels, and more, delivered effortlessly to your smartphone.",https://www.indiegogo.com/projects/healbe-gobe-the-only-way-to-automatically-measure-calorie-intake,http://iotlist.co/posts/healbe-gobe-automatically-measure-calorie-intake,http://healbe.com/
http://iotlist.co/?page=36,Helios: Transform any bike into a smart bike with Helios Bars,http://iotlist.co/posts/helios-transform-any-bike-into-a-smart-bike-with-helios-bars,http://iotlist-production.s3-us-west-2.amazonaws.com/uploads/production/post_attachment/351/file/2.jpg,"Helios Bars are the world's first integrated headlight & blinker system for bicycles. Features include smartphone connectivity (via Bluetooth 4.0 Low-Energy), visual speedometer, GPS tracking, turn-by-turn navigation, and much more.",http://www.ridehelios.com/products.php,http://iotlist.co/posts/helios-transform-any-bike-into-a-smart-bike-with-helios-bars,http://www.ridehelios.com/
http://iotlist.co/?page=12,Hendo: A real hoverboard,http://iotlist.co/posts/hendo-a-real-hoverboard,http://iotlist-production.s3-us-west-2.amazonaws.com/uploads/production/post_attachment/831/file/hendo_monopatin_regreso_al_futuro_5.jpg,Hendo is introducing the world's first REAL hoverboard and hover developer kit. We are putting hover technology in your hands.,https://www.kickstarter.com/projects/142464853/hendo-hoverboards-worlds-first-real-hoverboard,http://iotlist.co/posts/hendo-a-real-hoverboard,http://www.hendohover.com/#/
http://iotlist.co/?page=11,Hendo: A real hoverboard,http://iotlist.co/posts/hendo-a-real-hoverboard,http://iotlist-production.s3-us-west-2.amazonaws.com/uploads/production/post_attachment/831/file/hendo_monopatin_regreso_al_futuro_5.jpg,Hendo is introducing the world's first REAL hoverboard and hover developer kit. We are putting hover technology in your hands.,https://www.kickstarter.com/projects/142464853/hendo-hoverboards-worlds-first-real-hoverboard,http://iotlist.co/posts/hendo-a-real-hoverboard,http://www.hendohover.com/#/
http://iotlist.co/?page=24,hereO: GPS watch designed for kids,http://iotlist.co/posts/hereo-gps-watch-designed-for-kids,http://iotlist-production.s3-us-west-2.amazonaws.com/uploads/production/post_attachment/491/file/watches.png,"The hereO GPS watch is the world‰Ûªs smallest real-time connected GPS tracking device, created specifically for children three years and up. For the first time, tracking technology has been miniaturized to fit in a trendy kids watch. hereO enables parents to know the whereabouts of their children at any moment directly on their mobile via the hereO app.",https://www.indiegogo.com/projects/hereo-the-first-gps-watch-designed-for-young-kids,http://iotlist.co/posts/hereo-gps-watch-designed-for-kids,http://www.hereofamily.com/
http://iotlist.co/?page=25,hereO: GPS watch designed for kids,http://iotlist.co/posts/hereo-gps-watch-designed-for-kids,http://iotlist-production.s3-us-west-2.amazonaws.com/uploads/production/post_attachment/491/file/watches.png,"The hereO GPS watch is the world‰Ûªs smallest real-time connected GPS tracking device, created specifically for children three years and up. For the first time, tracking technology has been miniaturized to fit in a trendy kids watch. hereO enables parents to know the whereabouts of their children at any moment directly on their mobile via the hereO app.",https://www.indiegogo.com/projects/hereo-the-first-gps-watch-designed-for-young-kids,http://iotlist.co/posts/hereo-gps-watch-designed-for-kids,http://www.hereofamily.com/
http://iotlist.co/?page=18,Hicon: Smart wristband social bracelet,http://iotlist.co/posts/hicon-smart-wristband-social-bracelet,http://iotlist-production.s3-us-west-2.amazonaws.com/uploads/production/post_attachment/668/file/hicon_smart_bracelet_iphone.jpg,The Smart bracelet that updates you on the events of your social networks and allows you to socialize with people who share your same interests and passions.,https://www.indiegogo.com/projects/hicon-smart-wristband-social-bracelet-with-interchangeable-social-network-icons,http://iotlist.co/posts/hicon-smart-wristband-social-bracelet,http://www.hiconbangle.com/en/
http://iotlist.co/?page=13,Highfive: Video conferencing you can actually love,http://iotlist.co/posts/highfive-video-conferencing-you-can-actually-love,http://iotlist-production.s3-us-west-2.amazonaws.com/uploads/production/post_attachment/804/file/1.jpg,"Highfive is beautifully simple video conferencing for everyone, in every room, on every device.",https://www.highfive.com/pricing,http://iotlist.co/posts/highfive-video-conferencing-you-can-actually-love,https://www.highfive.com/
http://iotlist.co/?page=36,Hiku: Remembers for you and shops for you,http://iotlist.co/posts/hiku-remembers-for-you-and-shops-for-you,http://iotlist-production.s3-us-west-2.amazonaws.com/uploads/production/post_attachment/167/file/Web_hiku-iPhone5_440x555.jpg,"hiku scans barcodes and recognizes your voice, and then instantly adds items right to your shopping list.",http://hiku.us/,http://iotlist.co/posts/hiku-remembers-for-you-and-shops-for-you,http://hiku.us/
http://iotlist.co/?page=12,Homeboy: Accessible home security system,http://iotlist.co/posts/homeboy-accessible-home-security-system,http://iotlist-production.s3-us-west-2.amazonaws.com/uploads/production/post_attachment/952/file/camera-from-right-5611fb33.png,"Homeboy attaches magnetically, lasts for 3 months on a single charge, and automatically alerts you when motion is detected. The future of security is here. Get Homeboy today.",https://checkout.shopify.com/3355317/checkouts/5db1c0cc2452b1c20b03fb49b43ee9d4,http://iotlist.co/posts/homeboy-accessible-home-security-system,https://www.homeboy.com/
http://iotlist.co/?page=11,Homeboy: Accessible home security system,http://iotlist.co/posts/homeboy-accessible-home-security-system,http://iotlist-production.s3-us-west-2.amazonaws.com/uploads/production/post_attachment/952/file/camera-from-right-5611fb33.png,"Homeboy attaches magnetically, lasts for 3 months on a single charge, and automatically alerts you when motion is detected. The future of security is here. Get Homeboy today.",https://checkout.shopify.com/3355317/checkouts/5db1c0cc2452b1c20b03fb49b43ee9d4,http://iotlist.co/posts/homeboy-accessible-home-security-system,https://www.homeboy.com/
http://iotlist.co/?page=35,Homee: Your home remote,http://iotlist.co/posts/homee-your-home-remote,http://iotlist-production.s3-us-west-2.amazonaws.com/uploads/production/post_attachment/181/file/homee_at_home_650.jpg,"Homee is the simplest and smoothest way to control, monitor and automate your entire home - from all over the world.",http://www.indiegogo.com/projects/homee-your-home-remote--2,http://iotlist.co/posts/homee-your-home-remote,http://www.indiegogo.com/projects/homee-your-home-remote--2
http://iotlist.co/?page=20,Homey: Talk to your home,http://iotlist.co/posts/homey-talk-to-your-home,http://iotlist-production.s3-us-west-2.amazonaws.com/uploads/production/post_attachment/586/file/homeautomate33.jpg,"Homey is speech-controlled home automation. Talk to your home to control everything: from lights to music, from climate to TV.",https://www.kickstarter.com/projects/athom/homey-the-living-room-talk-to-your-home,http://iotlist.co/posts/homey-talk-to-your-home,http://www.athom.nl/
http://iotlist.co/?page=21,Homey: Talk to your home,http://iotlist.co/posts/homey-talk-to-your-home,http://iotlist-production.s3-us-west-2.amazonaws.com/uploads/production/post_attachment/586/file/homeautomate33.jpg,"Homey is speech-controlled home automation. Talk to your home to control everything: from lights to music, from climate to TV.",https://www.kickstarter.com/projects/athom/homey-the-living-room-talk-to-your-home,http://iotlist.co/posts/homey-talk-to-your-home,http://www.athom.nl/
http://iotlist.co/?page=9,Honeywell: Wifi smart thermostat,http://iotlist.co/posts/honeywell-wifi-smart-thermostat,http://iotlist-production.s3-us-west-2.amazonaws.com/uploads/production/post_attachment/916/file/7184KPM0IAL._SL1000_.jpg,Adjust your thermostat from anywhere and take comfort in knowing that from now on your home will always feel just right.,http://amzn.to/1FMZDPY,http://iotlist.co/posts/honeywell-wifi-smart-thermostat,http://wifithermostat.com/Products/WiFiSmartThermostat/
http://iotlist.co/?page=8,Hue Lux: Connected bulbs,http://iotlist.co/posts/hue-lux-connected-bulbs,http://iotlist-production.s3-us-west-2.amazonaws.com/uploads/production/post_attachment/926/file/HFV02.jpeg,"Simple and smart, hue lux bulbs produce beautiful warm white light that can be brightened and dimmed to suit any occasion.",http://amzn.to/1Cb59YL,http://iotlist.co/posts/hue-lux-connected-bulbs,http://www2.meethue.com/en-us/the-range/hue-lux/
http://iotlist.co/?page=14,Hue Tap: Wireless smart switch,http://iotlist.co/posts/hue-tap-wireless-smart-switch,http://iotlist-production.s3-us-west-2.amazonaws.com/uploads/production/post_attachment/789/file/6117q4vs81L._SL1500_.jpg,"Here‰Ûªs hue tap, the world's first wireless smart switch. Now control your hue lights in your home with just the push of a button. And there are four to choose from. One for a favorite scene. One for a light recipe. Or just one to switch some lights off. It‰Ûªs all up to you.",http://www.amazon.com/Philips-Hue-tap-Switch/dp/B00LY42URM/ref=sr_1_3?s=hi&ie=UTF8&qid=1411760539&sr=1-3&keywords=philips+hue,http://iotlist.co/posts/hue-tap-wireless-smart-switch,http://www2.meethue.com/en-us/the-range/hue-tap/
http://iotlist.co/?page=30,Hue: Connected light bulb,http://iotlist.co/posts/hue-connected-light-bulb,http://iotlist-production.s3-us-west-2.amazonaws.com/uploads/production/post_attachment/345/file/philips_hue_starter_pack_iphone.jpg,"Hue lets you play with tone, brightness and color to create your ideal lighting. Hue can help you to relax or concentrate, change the atmosphere of a room, help keep your house safe when you're out, even remind you of that magical moment on vacation. All from your smart device.",http://amzn.to/1nzlnIE,http://iotlist.co/posts/hue-connected-light-bulb,http://www.meethue.com/en-US
http://iotlist.co/?page=19,Hue: LivingColors Bloom,http://iotlist.co/posts/hue-livingcolors-bloom,http://iotlist-production.s3-us-west-2.amazonaws.com/uploads/production/post_attachment/607/file/233314330alt1.jpeg,"Create stunning light shows synced with your favorite music. Whether slow and relaxing or the coolest party in town, use Bloom to bring to life objects and corners in your house.",http://www.amazon.com/Philips-259952-Personal-Wireless-Frustration/dp/B00I12ZB4Y/ref=pd_rhf_dp_s_cp_1?ie=UTF8&refRID=15HSZJGPCXTGW2PX78Z8,http://iotlist.co/posts/hue-livingcolors-bloom,http://meethue.com/en-us/friends-of-hue/livingcolors-bloom/
http://iotlist.co/?page=20,Hue: LivingColors Bloom,http://iotlist.co/posts/hue-livingcolors-bloom,http://iotlist-production.s3-us-west-2.amazonaws.com/uploads/production/post_attachment/607/file/233314330alt1.jpeg,"Create stunning light shows synced with your favorite music. Whether slow and relaxing or the coolest party in town, use Bloom to bring to life objects and corners in your house.",http://www.amazon.com/Philips-259952-Personal-Wireless-Frustration/dp/B00I12ZB4Y/ref=pd_rhf_dp_s_cp_1?ie=UTF8&refRID=15HSZJGPCXTGW2PX78Z8,http://iotlist.co/posts/hue-livingcolors-bloom,http://meethue.com/en-us/friends-of-hue/livingcolors-bloom/
http://iotlist.co/?page=16,Hydrawise: WiFi Irrigation Controller with predictive watering,http://iotlist.co/posts/hydrawise-wifi-irrigation-controller-with-predictive-watering,http://iotlist-production.s3-us-west-2.amazonaws.com/uploads/production/post_attachment/711/file/HWC-006iPhone.jpg,"Control and monitor your sprinkler system from anywhere in the world using your web browser or our iPhone and Android apps. Use Hydrawise Predictive Watering to adjust your watering schedules based on temperature, rainfall, humidity or wind speed.; Our cloud based architecture means you don‰Ûªt need to perform any complicated port forwarding on your router or expose your system to security risks to be able to control your irrigation from anywhere in the world.",http://hydrawise.com/buy-now,http://iotlist.co/posts/hydrawise-wifi-irrigation-controller-with-predictive-watering,http://hydrawise.com/
http://iotlist.co/?page=14,iBaby Monitor: Digital video monitor with night vision,http://iotlist.co/posts/ibaby-monitor-digital-video-monitor-with-night-vision,http://iotlist-production.s3-us-west-2.amazonaws.com/uploads/production/post_attachment/798/file/810dkkJhb2L._SL1500_.jpg,"The iBaby Monitor M2 from iHealth is as mobile as your baby. Thanks to the magnetic base and rechargeable battery you can shift the camera to whatever room your baby is in for up to two hours. It also offers two-way audio, so you can communicate with your baby‰ÛÓno external speakers required.",http://ibabylabs.com/shop/ibaby-monitor-m2/,http://iotlist.co/posts/ibaby-monitor-digital-video-monitor-with-night-vision,http://ibabylabs.com/ibaby-monitor-m2/
http://iotlist.co/?page=27,ibitz: Fitness products for the entire family,http://iotlist.co/posts/ibitz-fitness-products-for-the-entire-family,http://iotlist-production.s3-us-west-2.amazonaws.com/uploads/production/post_attachment/420/file/pnlr_intro.jpg,"With ibitz for kids, children will have their character blast off and explore the galaxy in a spaceship powered by their steps. The more active the child is, the more they can explore and the more rewards they can earn. Adults can set goals and add rewards for their child to keep them active and exploring. Kids can even earn coins and exclusive content through Disney‰Ûªs Club Penguin.",http://www.bestbuy.com/site/promo/geopalz-ibitz-110633,http://iotlist.co/posts/ibitz-fitness-products-for-the-entire-family,http://ibitz.com/
